{
  "address": "0x08fA38472eB13c98F33782EAf6c0FA68D4A22D59",
  "abi": [
    {
      "inputs": [],
      "payable": false,
      "stateMutability": "nonpayable",
      "type": "constructor"
    },
    {
      "anonymous": false,
      "inputs": [
        {
          "indexed": true,
          "internalType": "address",
          "name": "owner",
          "type": "address"
        },
        {
          "indexed": true,
          "internalType": "address",
          "name": "spender",
          "type": "address"
        },
        {
          "indexed": false,
          "internalType": "uint256",
          "name": "value",
          "type": "uint256"
        }
      ],
      "name": "Approval",
      "type": "event"
    },
    {
      "anonymous": false,
      "inputs": [
        {
          "indexed": true,
          "internalType": "address",
          "name": "sender",
          "type": "address"
        },
        {
          "indexed": false,
          "internalType": "uint256",
          "name": "amount0",
          "type": "uint256"
        },
        {
          "indexed": false,
          "internalType": "uint256",
          "name": "amount1",
          "type": "uint256"
        },
        {
          "indexed": true,
          "internalType": "address",
          "name": "to",
          "type": "address"
        }
      ],
      "name": "Burn",
      "type": "event"
    },
    {
      "anonymous": false,
      "inputs": [
        {
          "indexed": true,
          "internalType": "address",
          "name": "sender",
          "type": "address"
        },
        {
          "indexed": false,
          "internalType": "uint256",
          "name": "amount0",
          "type": "uint256"
        },
        {
          "indexed": false,
          "internalType": "uint256",
          "name": "amount1",
          "type": "uint256"
        }
      ],
      "name": "Mint",
      "type": "event"
    },
    {
      "anonymous": false,
      "inputs": [
        {
          "indexed": true,
          "internalType": "address",
          "name": "sender",
          "type": "address"
        },
        {
          "indexed": false,
          "internalType": "uint256",
          "name": "amount0In",
          "type": "uint256"
        },
        {
          "indexed": false,
          "internalType": "uint256",
          "name": "amount1In",
          "type": "uint256"
        },
        {
          "indexed": false,
          "internalType": "uint256",
          "name": "amount0Out",
          "type": "uint256"
        },
        {
          "indexed": false,
          "internalType": "uint256",
          "name": "amount1Out",
          "type": "uint256"
        },
        {
          "indexed": true,
          "internalType": "address",
          "name": "to",
          "type": "address"
        }
      ],
      "name": "Swap",
      "type": "event"
    },
    {
      "anonymous": false,
      "inputs": [
        {
          "indexed": false,
          "internalType": "uint112",
          "name": "reserve0",
          "type": "uint112"
        },
        {
          "indexed": false,
          "internalType": "uint112",
          "name": "reserve1",
          "type": "uint112"
        }
      ],
      "name": "Sync",
      "type": "event"
    },
    {
      "anonymous": false,
      "inputs": [
        {
          "indexed": true,
          "internalType": "address",
          "name": "from",
          "type": "address"
        },
        {
          "indexed": true,
          "internalType": "address",
          "name": "to",
          "type": "address"
        },
        {
          "indexed": false,
          "internalType": "uint256",
          "name": "value",
          "type": "uint256"
        }
      ],
      "name": "Transfer",
      "type": "event"
    },
    {
      "constant": true,
      "inputs": [],
      "name": "DOMAIN_SEPARATOR",
      "outputs": [
        {
          "internalType": "bytes32",
          "name": "",
          "type": "bytes32"
        }
      ],
      "payable": false,
      "stateMutability": "view",
      "type": "function"
    },
    {
      "constant": true,
      "inputs": [],
      "name": "MINIMUM_LIQUIDITY",
      "outputs": [
        {
          "internalType": "uint256",
          "name": "",
          "type": "uint256"
        }
      ],
      "payable": false,
      "stateMutability": "view",
      "type": "function"
    },
    {
      "constant": true,
      "inputs": [],
      "name": "PERMIT_TYPEHASH",
      "outputs": [
        {
          "internalType": "bytes32",
          "name": "",
          "type": "bytes32"
        }
      ],
      "payable": false,
      "stateMutability": "view",
      "type": "function"
    },
    {
      "constant": true,
      "inputs": [
        {
          "internalType": "address",
          "name": "",
          "type": "address"
        },
        {
          "internalType": "address",
          "name": "",
          "type": "address"
        }
      ],
      "name": "allowance",
      "outputs": [
        {
          "internalType": "uint256",
          "name": "",
          "type": "uint256"
        }
      ],
      "payable": false,
      "stateMutability": "view",
      "type": "function"
    },
    {
      "constant": false,
      "inputs": [
        {
          "internalType": "address",
          "name": "spender",
          "type": "address"
        },
        {
          "internalType": "uint256",
          "name": "value",
          "type": "uint256"
        }
      ],
      "name": "approve",
      "outputs": [
        {
          "internalType": "bool",
          "name": "",
          "type": "bool"
        }
      ],
      "payable": false,
      "stateMutability": "nonpayable",
      "type": "function"
    },
    {
      "constant": true,
      "inputs": [
        {
          "internalType": "address",
          "name": "",
          "type": "address"
        }
      ],
      "name": "balanceOf",
      "outputs": [
        {
          "internalType": "uint256",
          "name": "",
          "type": "uint256"
        }
      ],
      "payable": false,
      "stateMutability": "view",
      "type": "function"
    },
    {
      "constant": false,
      "inputs": [
        {
          "internalType": "address",
          "name": "to",
          "type": "address"
        }
      ],
      "name": "burn",
      "outputs": [
        {
          "internalType": "uint256",
          "name": "amount0",
          "type": "uint256"
        },
        {
          "internalType": "uint256",
          "name": "amount1",
          "type": "uint256"
        }
      ],
      "payable": false,
      "stateMutability": "nonpayable",
      "type": "function"
    },
    {
      "constant": true,
      "inputs": [],
      "name": "decimals",
      "outputs": [
        {
          "internalType": "uint8",
          "name": "",
          "type": "uint8"
        }
      ],
      "payable": false,
      "stateMutability": "view",
      "type": "function"
    },
    {
      "constant": true,
      "inputs": [],
      "name": "factory",
      "outputs": [
        {
          "internalType": "address",
          "name": "",
          "type": "address"
        }
      ],
      "payable": false,
      "stateMutability": "view",
      "type": "function"
    },
    {
      "constant": true,
      "inputs": [],
      "name": "getReserves",
      "outputs": [
        {
          "internalType": "uint112",
          "name": "_reserve0",
          "type": "uint112"
        },
        {
          "internalType": "uint112",
          "name": "_reserve1",
          "type": "uint112"
        },
        {
          "internalType": "uint32",
          "name": "_blockTimestampLast",
          "type": "uint32"
        }
      ],
      "payable": false,
      "stateMutability": "view",
      "type": "function"
    },
    {
      "constant": false,
      "inputs": [
        {
          "internalType": "address",
          "name": "_token0",
          "type": "address"
        },
        {
          "internalType": "address",
          "name": "_token1",
          "type": "address"
        }
      ],
      "name": "initialize",
      "outputs": [],
      "payable": false,
      "stateMutability": "nonpayable",
      "type": "function"
    },
    {
      "constant": true,
      "inputs": [],
      "name": "kLast",
      "outputs": [
        {
          "internalType": "uint256",
          "name": "",
          "type": "uint256"
        }
      ],
      "payable": false,
      "stateMutability": "view",
      "type": "function"
    },
    {
      "constant": false,
      "inputs": [
        {
          "internalType": "address",
          "name": "to",
          "type": "address"
        }
      ],
      "name": "mint",
      "outputs": [
        {
          "internalType": "uint256",
          "name": "liquidity",
          "type": "uint256"
        }
      ],
      "payable": false,
      "stateMutability": "nonpayable",
      "type": "function"
    },
    {
      "constant": true,
      "inputs": [],
      "name": "name",
      "outputs": [
        {
          "internalType": "string",
          "name": "",
          "type": "string"
        }
      ],
      "payable": false,
      "stateMutability": "view",
      "type": "function"
    },
    {
      "constant": true,
      "inputs": [
        {
          "internalType": "address",
          "name": "",
          "type": "address"
        }
      ],
      "name": "nonces",
      "outputs": [
        {
          "internalType": "uint256",
          "name": "",
          "type": "uint256"
        }
      ],
      "payable": false,
      "stateMutability": "view",
      "type": "function"
    },
    {
      "constant": false,
      "inputs": [
        {
          "internalType": "address",
          "name": "owner",
          "type": "address"
        },
        {
          "internalType": "address",
          "name": "spender",
          "type": "address"
        },
        {
          "internalType": "uint256",
          "name": "value",
          "type": "uint256"
        },
        {
          "internalType": "uint256",
          "name": "deadline",
          "type": "uint256"
        },
        {
          "internalType": "uint8",
          "name": "v",
          "type": "uint8"
        },
        {
          "internalType": "bytes32",
          "name": "r",
          "type": "bytes32"
        },
        {
          "internalType": "bytes32",
          "name": "s",
          "type": "bytes32"
        }
      ],
      "name": "permit",
      "outputs": [],
      "payable": false,
      "stateMutability": "nonpayable",
      "type": "function"
    },
    {
      "constant": true,
      "inputs": [
        {
          "internalType": "address",
          "name": "token",
          "type": "address"
        },
        {
          "internalType": "uint256",
          "name": "baseDecimal",
          "type": "uint256"
        }
      ],
      "name": "price",
      "outputs": [
        {
          "internalType": "uint256",
          "name": "",
          "type": "uint256"
        }
      ],
      "payable": false,
      "stateMutability": "view",
      "type": "function"
    },
    {
      "constant": true,
      "inputs": [],
      "name": "price0CumulativeLast",
      "outputs": [
        {
          "internalType": "uint256",
          "name": "",
          "type": "uint256"
        }
      ],
      "payable": false,
      "stateMutability": "view",
      "type": "function"
    },
    {
      "constant": true,
      "inputs": [],
      "name": "price1CumulativeLast",
      "outputs": [
        {
          "internalType": "uint256",
          "name": "",
          "type": "uint256"
        }
      ],
      "payable": false,
      "stateMutability": "view",
      "type": "function"
    },
    {
      "constant": false,
      "inputs": [
        {
          "internalType": "address",
          "name": "to",
          "type": "address"
        }
      ],
      "name": "skim",
      "outputs": [],
      "payable": false,
      "stateMutability": "nonpayable",
      "type": "function"
    },
    {
      "constant": false,
      "inputs": [
        {
          "internalType": "uint256",
          "name": "amount0Out",
          "type": "uint256"
        },
        {
          "internalType": "uint256",
          "name": "amount1Out",
          "type": "uint256"
        },
        {
          "internalType": "address",
          "name": "to",
          "type": "address"
        },
        {
          "internalType": "bytes",
          "name": "data",
          "type": "bytes"
        }
      ],
      "name": "swap",
      "outputs": [],
      "payable": false,
      "stateMutability": "nonpayable",
      "type": "function"
    },
    {
      "constant": true,
      "inputs": [],
      "name": "symbol",
      "outputs": [
        {
          "internalType": "string",
          "name": "",
          "type": "string"
        }
      ],
      "payable": false,
      "stateMutability": "view",
      "type": "function"
    },
    {
      "constant": false,
      "inputs": [],
      "name": "sync",
      "outputs": [],
      "payable": false,
      "stateMutability": "nonpayable",
      "type": "function"
    },
    {
      "constant": true,
      "inputs": [],
      "name": "token0",
      "outputs": [
        {
          "internalType": "address",
          "name": "",
          "type": "address"
        }
      ],
      "payable": false,
      "stateMutability": "view",
      "type": "function"
    },
    {
      "constant": true,
      "inputs": [],
      "name": "token1",
      "outputs": [
        {
          "internalType": "address",
          "name": "",
          "type": "address"
        }
      ],
      "payable": false,
      "stateMutability": "view",
      "type": "function"
    },
    {
      "constant": true,
      "inputs": [],
      "name": "totalSupply",
      "outputs": [
        {
          "internalType": "uint256",
          "name": "",
          "type": "uint256"
        }
      ],
      "payable": false,
      "stateMutability": "view",
      "type": "function"
    },
    {
      "constant": false,
      "inputs": [
        {
          "internalType": "address",
          "name": "to",
          "type": "address"
        },
        {
          "internalType": "uint256",
          "name": "value",
          "type": "uint256"
        }
      ],
      "name": "transfer",
      "outputs": [
        {
          "internalType": "bool",
          "name": "",
          "type": "bool"
        }
      ],
      "payable": false,
      "stateMutability": "nonpayable",
      "type": "function"
    },
    {
      "constant": false,
      "inputs": [
        {
          "internalType": "address",
          "name": "from",
          "type": "address"
        },
        {
          "internalType": "address",
          "name": "to",
          "type": "address"
        },
        {
          "internalType": "uint256",
          "name": "value",
          "type": "uint256"
        }
      ],
      "name": "transferFrom",
      "outputs": [
        {
          "internalType": "bool",
          "name": "",
          "type": "bool"
        }
      ],
      "payable": false,
      "stateMutability": "nonpayable",
      "type": "function"
    }
  ],
  "transactionHash": "0xa61b021097c27461268d0f7e1697daa4d46a322b451802cac66d6f1271995bdd",
  "receipt": {
    "to": null,
    "from": "0x49d531908840FDDaC744543d57CB21B91c3D9094",
    "contractAddress": "0x08fA38472eB13c98F33782EAf6c0FA68D4A22D59",
    "transactionIndex": 1,
    "gasUsed": "2188449",
    "logsBloom": "0x00000000000000000000000000000000000000000000000000000000000000000000000000000000000000000000000000000000000000000000000000000000000000000000000000000000000000000000000000000000000000000000000000000000000000000000000000000000000000000000000000000000000000000000000000000000000000000000000000000000000000000000000000000000000000000000000000000000000000000000000000000000000000000000000000000000000000000000000000000000000000000000000000000000000000000000000000000000000000000000000000000000000000000000000000000000",
    "blockHash": "0x19ff861092df919b2f760515fb9c5d32a04eadc9bd2b9be8602b822e30e93265",
    "transactionHash": "0xa61b021097c27461268d0f7e1697daa4d46a322b451802cac66d6f1271995bdd",
    "logs": [],
    "blockNumber": 5652940,
    "cumulativeGasUsed": "2228551",
    "status": 1,
    "byzantium": true
  },
  "args": [],
  "solcInputHash": "6cdca1cb5bb65eb3573c38be07131f12",
  "metadata": "{\"compiler\":{\"version\":\"0.5.16+commit.9c3226ce\"},\"language\":\"Solidity\",\"output\":{\"abi\":[{\"inputs\":[],\"payable\":false,\"stateMutability\":\"nonpayable\",\"type\":\"constructor\"},{\"anonymous\":false,\"inputs\":[{\"indexed\":true,\"internalType\":\"address\",\"name\":\"owner\",\"type\":\"address\"},{\"indexed\":true,\"internalType\":\"address\",\"name\":\"spender\",\"type\":\"address\"},{\"indexed\":false,\"internalType\":\"uint256\",\"name\":\"value\",\"type\":\"uint256\"}],\"name\":\"Approval\",\"type\":\"event\"},{\"anonymous\":false,\"inputs\":[{\"indexed\":true,\"internalType\":\"address\",\"name\":\"sender\",\"type\":\"address\"},{\"indexed\":false,\"internalType\":\"uint256\",\"name\":\"amount0\",\"type\":\"uint256\"},{\"indexed\":false,\"internalType\":\"uint256\",\"name\":\"amount1\",\"type\":\"uint256\"},{\"indexed\":true,\"internalType\":\"address\",\"name\":\"to\",\"type\":\"address\"}],\"name\":\"Burn\",\"type\":\"event\"},{\"anonymous\":false,\"inputs\":[{\"indexed\":true,\"internalType\":\"address\",\"name\":\"sender\",\"type\":\"address\"},{\"indexed\":false,\"internalType\":\"uint256\",\"name\":\"amount0\",\"type\":\"uint256\"},{\"indexed\":false,\"internalType\":\"uint256\",\"name\":\"amount1\",\"type\":\"uint256\"}],\"name\":\"Mint\",\"type\":\"event\"},{\"anonymous\":false,\"inputs\":[{\"indexed\":true,\"internalType\":\"address\",\"name\":\"sender\",\"type\":\"address\"},{\"indexed\":false,\"internalType\":\"uint256\",\"name\":\"amount0In\",\"type\":\"uint256\"},{\"indexed\":false,\"internalType\":\"uint256\",\"name\":\"amount1In\",\"type\":\"uint256\"},{\"indexed\":false,\"internalType\":\"uint256\",\"name\":\"amount0Out\",\"type\":\"uint256\"},{\"indexed\":false,\"internalType\":\"uint256\",\"name\":\"amount1Out\",\"type\":\"uint256\"},{\"indexed\":true,\"internalType\":\"address\",\"name\":\"to\",\"type\":\"address\"}],\"name\":\"Swap\",\"type\":\"event\"},{\"anonymous\":false,\"inputs\":[{\"indexed\":false,\"internalType\":\"uint112\",\"name\":\"reserve0\",\"type\":\"uint112\"},{\"indexed\":false,\"internalType\":\"uint112\",\"name\":\"reserve1\",\"type\":\"uint112\"}],\"name\":\"Sync\",\"type\":\"event\"},{\"anonymous\":false,\"inputs\":[{\"indexed\":true,\"internalType\":\"address\",\"name\":\"from\",\"type\":\"address\"},{\"indexed\":true,\"internalType\":\"address\",\"name\":\"to\",\"type\":\"address\"},{\"indexed\":false,\"internalType\":\"uint256\",\"name\":\"value\",\"type\":\"uint256\"}],\"name\":\"Transfer\",\"type\":\"event\"},{\"constant\":true,\"inputs\":[],\"name\":\"DOMAIN_SEPARATOR\",\"outputs\":[{\"internalType\":\"bytes32\",\"name\":\"\",\"type\":\"bytes32\"}],\"payable\":false,\"stateMutability\":\"view\",\"type\":\"function\"},{\"constant\":true,\"inputs\":[],\"name\":\"MINIMUM_LIQUIDITY\",\"outputs\":[{\"internalType\":\"uint256\",\"name\":\"\",\"type\":\"uint256\"}],\"payable\":false,\"stateMutability\":\"view\",\"type\":\"function\"},{\"constant\":true,\"inputs\":[],\"name\":\"PERMIT_TYPEHASH\",\"outputs\":[{\"internalType\":\"bytes32\",\"name\":\"\",\"type\":\"bytes32\"}],\"payable\":false,\"stateMutability\":\"view\",\"type\":\"function\"},{\"constant\":true,\"inputs\":[{\"internalType\":\"address\",\"name\":\"\",\"type\":\"address\"},{\"internalType\":\"address\",\"name\":\"\",\"type\":\"address\"}],\"name\":\"allowance\",\"outputs\":[{\"internalType\":\"uint256\",\"name\":\"\",\"type\":\"uint256\"}],\"payable\":false,\"stateMutability\":\"view\",\"type\":\"function\"},{\"constant\":false,\"inputs\":[{\"internalType\":\"address\",\"name\":\"spender\",\"type\":\"address\"},{\"internalType\":\"uint256\",\"name\":\"value\",\"type\":\"uint256\"}],\"name\":\"approve\",\"outputs\":[{\"internalType\":\"bool\",\"name\":\"\",\"type\":\"bool\"}],\"payable\":false,\"stateMutability\":\"nonpayable\",\"type\":\"function\"},{\"constant\":true,\"inputs\":[{\"internalType\":\"address\",\"name\":\"\",\"type\":\"address\"}],\"name\":\"balanceOf\",\"outputs\":[{\"internalType\":\"uint256\",\"name\":\"\",\"type\":\"uint256\"}],\"payable\":false,\"stateMutability\":\"view\",\"type\":\"function\"},{\"constant\":false,\"inputs\":[{\"internalType\":\"address\",\"name\":\"to\",\"type\":\"address\"}],\"name\":\"burn\",\"outputs\":[{\"internalType\":\"uint256\",\"name\":\"amount0\",\"type\":\"uint256\"},{\"internalType\":\"uint256\",\"name\":\"amount1\",\"type\":\"uint256\"}],\"payable\":false,\"stateMutability\":\"nonpayable\",\"type\":\"function\"},{\"constant\":true,\"inputs\":[],\"name\":\"decimals\",\"outputs\":[{\"internalType\":\"uint8\",\"name\":\"\",\"type\":\"uint8\"}],\"payable\":false,\"stateMutability\":\"view\",\"type\":\"function\"},{\"constant\":true,\"inputs\":[],\"name\":\"factory\",\"outputs\":[{\"internalType\":\"address\",\"name\":\"\",\"type\":\"address\"}],\"payable\":false,\"stateMutability\":\"view\",\"type\":\"function\"},{\"constant\":true,\"inputs\":[],\"name\":\"getReserves\",\"outputs\":[{\"internalType\":\"uint112\",\"name\":\"_reserve0\",\"type\":\"uint112\"},{\"internalType\":\"uint112\",\"name\":\"_reserve1\",\"type\":\"uint112\"},{\"internalType\":\"uint32\",\"name\":\"_blockTimestampLast\",\"type\":\"uint32\"}],\"payable\":false,\"stateMutability\":\"view\",\"type\":\"function\"},{\"constant\":false,\"inputs\":[{\"internalType\":\"address\",\"name\":\"_token0\",\"type\":\"address\"},{\"internalType\":\"address\",\"name\":\"_token1\",\"type\":\"address\"}],\"name\":\"initialize\",\"outputs\":[],\"payable\":false,\"stateMutability\":\"nonpayable\",\"type\":\"function\"},{\"constant\":true,\"inputs\":[],\"name\":\"kLast\",\"outputs\":[{\"internalType\":\"uint256\",\"name\":\"\",\"type\":\"uint256\"}],\"payable\":false,\"stateMutability\":\"view\",\"type\":\"function\"},{\"constant\":false,\"inputs\":[{\"internalType\":\"address\",\"name\":\"to\",\"type\":\"address\"}],\"name\":\"mint\",\"outputs\":[{\"internalType\":\"uint256\",\"name\":\"liquidity\",\"type\":\"uint256\"}],\"payable\":false,\"stateMutability\":\"nonpayable\",\"type\":\"function\"},{\"constant\":true,\"inputs\":[],\"name\":\"name\",\"outputs\":[{\"internalType\":\"string\",\"name\":\"\",\"type\":\"string\"}],\"payable\":false,\"stateMutability\":\"view\",\"type\":\"function\"},{\"constant\":true,\"inputs\":[{\"internalType\":\"address\",\"name\":\"\",\"type\":\"address\"}],\"name\":\"nonces\",\"outputs\":[{\"internalType\":\"uint256\",\"name\":\"\",\"type\":\"uint256\"}],\"payable\":false,\"stateMutability\":\"view\",\"type\":\"function\"},{\"constant\":false,\"inputs\":[{\"internalType\":\"address\",\"name\":\"owner\",\"type\":\"address\"},{\"internalType\":\"address\",\"name\":\"spender\",\"type\":\"address\"},{\"internalType\":\"uint256\",\"name\":\"value\",\"type\":\"uint256\"},{\"internalType\":\"uint256\",\"name\":\"deadline\",\"type\":\"uint256\"},{\"internalType\":\"uint8\",\"name\":\"v\",\"type\":\"uint8\"},{\"internalType\":\"bytes32\",\"name\":\"r\",\"type\":\"bytes32\"},{\"internalType\":\"bytes32\",\"name\":\"s\",\"type\":\"bytes32\"}],\"name\":\"permit\",\"outputs\":[],\"payable\":false,\"stateMutability\":\"nonpayable\",\"type\":\"function\"},{\"constant\":true,\"inputs\":[{\"internalType\":\"address\",\"name\":\"token\",\"type\":\"address\"},{\"internalType\":\"uint256\",\"name\":\"baseDecimal\",\"type\":\"uint256\"}],\"name\":\"price\",\"outputs\":[{\"internalType\":\"uint256\",\"name\":\"\",\"type\":\"uint256\"}],\"payable\":false,\"stateMutability\":\"view\",\"type\":\"function\"},{\"constant\":true,\"inputs\":[],\"name\":\"price0CumulativeLast\",\"outputs\":[{\"internalType\":\"uint256\",\"name\":\"\",\"type\":\"uint256\"}],\"payable\":false,\"stateMutability\":\"view\",\"type\":\"function\"},{\"constant\":true,\"inputs\":[],\"name\":\"price1CumulativeLast\",\"outputs\":[{\"internalType\":\"uint256\",\"name\":\"\",\"type\":\"uint256\"}],\"payable\":false,\"stateMutability\":\"view\",\"type\":\"function\"},{\"constant\":false,\"inputs\":[{\"internalType\":\"address\",\"name\":\"to\",\"type\":\"address\"}],\"name\":\"skim\",\"outputs\":[],\"payable\":false,\"stateMutability\":\"nonpayable\",\"type\":\"function\"},{\"constant\":false,\"inputs\":[{\"internalType\":\"uint256\",\"name\":\"amount0Out\",\"type\":\"uint256\"},{\"internalType\":\"uint256\",\"name\":\"amount1Out\",\"type\":\"uint256\"},{\"internalType\":\"address\",\"name\":\"to\",\"type\":\"address\"},{\"internalType\":\"bytes\",\"name\":\"data\",\"type\":\"bytes\"}],\"name\":\"swap\",\"outputs\":[],\"payable\":false,\"stateMutability\":\"nonpayable\",\"type\":\"function\"},{\"constant\":true,\"inputs\":[],\"name\":\"symbol\",\"outputs\":[{\"internalType\":\"string\",\"name\":\"\",\"type\":\"string\"}],\"payable\":false,\"stateMutability\":\"view\",\"type\":\"function\"},{\"constant\":false,\"inputs\":[],\"name\":\"sync\",\"outputs\":[],\"payable\":false,\"stateMutability\":\"nonpayable\",\"type\":\"function\"},{\"constant\":true,\"inputs\":[],\"name\":\"token0\",\"outputs\":[{\"internalType\":\"address\",\"name\":\"\",\"type\":\"address\"}],\"payable\":false,\"stateMutability\":\"view\",\"type\":\"function\"},{\"constant\":true,\"inputs\":[],\"name\":\"token1\",\"outputs\":[{\"internalType\":\"address\",\"name\":\"\",\"type\":\"address\"}],\"payable\":false,\"stateMutability\":\"view\",\"type\":\"function\"},{\"constant\":true,\"inputs\":[],\"name\":\"totalSupply\",\"outputs\":[{\"internalType\":\"uint256\",\"name\":\"\",\"type\":\"uint256\"}],\"payable\":false,\"stateMutability\":\"view\",\"type\":\"function\"},{\"constant\":false,\"inputs\":[{\"internalType\":\"address\",\"name\":\"to\",\"type\":\"address\"},{\"internalType\":\"uint256\",\"name\":\"value\",\"type\":\"uint256\"}],\"name\":\"transfer\",\"outputs\":[{\"internalType\":\"bool\",\"name\":\"\",\"type\":\"bool\"}],\"payable\":false,\"stateMutability\":\"nonpayable\",\"type\":\"function\"},{\"constant\":false,\"inputs\":[{\"internalType\":\"address\",\"name\":\"from\",\"type\":\"address\"},{\"internalType\":\"address\",\"name\":\"to\",\"type\":\"address\"},{\"internalType\":\"uint256\",\"name\":\"value\",\"type\":\"uint256\"}],\"name\":\"transferFrom\",\"outputs\":[{\"internalType\":\"bool\",\"name\":\"\",\"type\":\"bool\"}],\"payable\":false,\"stateMutability\":\"nonpayable\",\"type\":\"function\"}],\"devdoc\":{\"methods\":{}},\"userdoc\":{\"methods\":{}}},\"settings\":{\"compilationTarget\":{\"contracts/common/MdexFactory.sol\":\"MdexPair\"},\"evmVersion\":\"istanbul\",\"libraries\":{},\"metadata\":{\"useLiteralContent\":true},\"optimizer\":{\"enabled\":true,\"runs\":200},\"remappings\":[]},\"sources\":{\"contracts/common/MdexFactory.sol\":{\"content\":\"/**\\r\\n *Submitted for verification at hecoinfo.com on 2021-02-25\\r\\n*/\\r\\n\\r\\npragma solidity =0.5.16;\\r\\n\\r\\ninterface IMdexFactory {\\r\\n    event PairCreated(address indexed token0, address indexed token1, address pair, uint);\\r\\n\\r\\n    function feeTo() external view returns (address);\\r\\n\\r\\n    function feeToSetter() external view returns (address);\\r\\n\\r\\n    function feeToRate() external view returns (uint256);\\r\\n\\r\\n    function initCodeHash() external view returns (bytes32);\\r\\n\\r\\n    function getPair(address tokenA, address tokenB) external view returns (address pair);\\r\\n\\r\\n    function allPairs(uint) external view returns (address pair);\\r\\n\\r\\n    function allPairsLength() external view returns (uint);\\r\\n\\r\\n    function createPair(address tokenA, address tokenB) external returns (address pair);\\r\\n\\r\\n    function setFeeTo(address) external;\\r\\n\\r\\n    function setFeeToSetter(address) external;\\r\\n\\r\\n    function setFeeToRate(uint256) external;\\r\\n\\r\\n    function setInitCodeHash(bytes32) external;\\r\\n\\r\\n    function sortTokens(address tokenA, address tokenB) external pure returns (address token0, address token1);\\r\\n\\r\\n    function pairFor(address tokenA, address tokenB) external view returns (address pair);\\r\\n\\r\\n    function getReserves(address tokenA, address tokenB) external view returns (uint256 reserveA, uint256 reserveB);\\r\\n\\r\\n    function quote(uint256 amountA, uint256 reserveA, uint256 reserveB) external pure returns (uint256 amountB);\\r\\n\\r\\n    function getAmountOut(uint256 amountIn, uint256 reserveIn, uint256 reserveOut) external view returns (uint256 amountOut);\\r\\n\\r\\n    function getAmountIn(uint256 amountOut, uint256 reserveIn, uint256 reserveOut) external view returns (uint256 amountIn);\\r\\n\\r\\n    function getAmountsOut(uint256 amountIn, address[] calldata path) external view returns (uint256[] memory amounts);\\r\\n\\r\\n    function getAmountsIn(uint256 amountOut, address[] calldata path) external view returns (uint256[] memory amounts);\\r\\n}\\r\\n\\r\\ninterface IMdexPair {\\r\\n    event Approval(address indexed owner, address indexed spender, uint value);\\r\\n    event Transfer(address indexed from, address indexed to, uint value);\\r\\n\\r\\n    function name() external pure returns (string memory);\\r\\n\\r\\n    function symbol() external pure returns (string memory);\\r\\n\\r\\n    function decimals() external pure returns (uint8);\\r\\n\\r\\n    function totalSupply() external view returns (uint);\\r\\n\\r\\n    function balanceOf(address owner) external view returns (uint);\\r\\n\\r\\n    function allowance(address owner, address spender) external view returns (uint);\\r\\n\\r\\n    function approve(address spender, uint value) external returns (bool);\\r\\n\\r\\n    function transfer(address to, uint value) external returns (bool);\\r\\n\\r\\n    function transferFrom(address from, address to, uint value) external returns (bool);\\r\\n\\r\\n    function DOMAIN_SEPARATOR() external view returns (bytes32);\\r\\n\\r\\n    function PERMIT_TYPEHASH() external pure returns (bytes32);\\r\\n\\r\\n    function nonces(address owner) external view returns (uint);\\r\\n\\r\\n    function permit(address owner, address spender, uint value, uint deadline, uint8 v, bytes32 r, bytes32 s) external;\\r\\n\\r\\n    event Mint(address indexed sender, uint amount0, uint amount1);\\r\\n    event Burn(address indexed sender, uint amount0, uint amount1, address indexed to);\\r\\n    event Swap(\\r\\n        address indexed sender,\\r\\n        uint amount0In,\\r\\n        uint amount1In,\\r\\n        uint amount0Out,\\r\\n        uint amount1Out,\\r\\n        address indexed to\\r\\n    );\\r\\n    event Sync(uint112 reserve0, uint112 reserve1);\\r\\n\\r\\n    function MINIMUM_LIQUIDITY() external pure returns (uint);\\r\\n\\r\\n    function factory() external view returns (address);\\r\\n\\r\\n    function token0() external view returns (address);\\r\\n\\r\\n    function token1() external view returns (address);\\r\\n\\r\\n    function getReserves() external view returns (uint112 reserve0, uint112 reserve1, uint32 blockTimestampLast);\\r\\n\\r\\n    function price0CumulativeLast() external view returns (uint);\\r\\n\\r\\n    function price1CumulativeLast() external view returns (uint);\\r\\n\\r\\n    function kLast() external view returns (uint);\\r\\n\\r\\n    function mint(address to) external returns (uint liquidity);\\r\\n\\r\\n    function burn(address to) external returns (uint amount0, uint amount1);\\r\\n\\r\\n    function swap(uint amount0Out, uint amount1Out, address to, bytes calldata data) external;\\r\\n\\r\\n    function skim(address to) external;\\r\\n\\r\\n    function sync() external;\\r\\n\\r\\n    function price(address token, uint256 baseDecimal) external view returns (uint256);\\r\\n\\r\\n    function initialize(address, address) external;\\r\\n}\\r\\n\\r\\ninterface IMdexERC20 {\\r\\n    event Approval(address indexed owner, address indexed spender, uint value);\\r\\n    event Transfer(address indexed from, address indexed to, uint value);\\r\\n\\r\\n    function name() external pure returns (string memory);\\r\\n\\r\\n    function symbol() external pure returns (string memory);\\r\\n\\r\\n    function decimals() external pure returns (uint8);\\r\\n\\r\\n    function totalSupply() external view returns (uint);\\r\\n\\r\\n    function balanceOf(address owner) external view returns (uint);\\r\\n\\r\\n    function allowance(address owner, address spender) external view returns (uint);\\r\\n\\r\\n    function approve(address spender, uint value) external returns (bool);\\r\\n\\r\\n    function transfer(address to, uint value) external returns (bool);\\r\\n\\r\\n    function transferFrom(address from, address to, uint value) external returns (bool);\\r\\n\\r\\n    function DOMAIN_SEPARATOR() external view returns (bytes32);\\r\\n\\r\\n    function PERMIT_TYPEHASH() external pure returns (bytes32);\\r\\n\\r\\n    function nonces(address owner) external view returns (uint);\\r\\n\\r\\n    function permit(address owner, address spender, uint value, uint deadline, uint8 v, bytes32 r, bytes32 s) external;\\r\\n}\\r\\n\\r\\ninterface IERC20 {\\r\\n    event Approval(address indexed owner, address indexed spender, uint value);\\r\\n    event Transfer(address indexed from, address indexed to, uint value);\\r\\n\\r\\n    function name() external view returns (string memory);\\r\\n\\r\\n    function symbol() external view returns (string memory);\\r\\n\\r\\n    function decimals() external view returns (uint8);\\r\\n\\r\\n    function totalSupply() external view returns (uint);\\r\\n\\r\\n    function balanceOf(address owner) external view returns (uint);\\r\\n\\r\\n    function allowance(address owner, address spender) external view returns (uint);\\r\\n\\r\\n    function approve(address spender, uint value) external returns (bool);\\r\\n\\r\\n    function transfer(address to, uint value) external returns (bool);\\r\\n\\r\\n    function transferFrom(address from, address to, uint value) external returns (bool);\\r\\n}\\r\\n\\r\\ninterface IHswapV2Callee {\\r\\n    function hswapV2Call(address sender, uint amount0, uint amount1, bytes calldata data) external;\\r\\n}\\r\\n\\r\\ncontract MdexERC20 is IMdexERC20 {\\r\\n    using SafeMath for uint;\\r\\n\\r\\n    string public constant name = 'HSwap LP Token';\\r\\n    string public constant symbol = 'HMDX';\\r\\n    uint8 public constant decimals = 18;\\r\\n    uint  public totalSupply;\\r\\n    mapping(address => uint) public balanceOf;\\r\\n    mapping(address => mapping(address => uint)) public allowance;\\r\\n\\r\\n    bytes32 public DOMAIN_SEPARATOR;\\r\\n    // keccak256(\\\"Permit(address owner,address spender,uint256 value,uint256 nonce,uint256 deadline)\\\");\\r\\n    bytes32 public constant PERMIT_TYPEHASH = 0x6e71edae12b1b97f4d1f60370fef10105fa2faae0126114a169c64845d6126c9;\\r\\n    mapping(address => uint) public nonces;\\r\\n\\r\\n    event Approval(address indexed owner, address indexed spender, uint value);\\r\\n    event Transfer(address indexed from, address indexed to, uint value);\\r\\n\\r\\n    constructor() public {\\r\\n        uint chainId;\\r\\n        assembly {\\r\\n            chainId := chainid\\r\\n        }\\r\\n        DOMAIN_SEPARATOR = keccak256(\\r\\n            abi.encode(\\r\\n                keccak256('EIP712Domain(string name,string version,uint256 chainId,address verifyingContract)'),\\r\\n                keccak256(bytes(name)),\\r\\n                keccak256(bytes('1')),\\r\\n                chainId,\\r\\n                address(this)\\r\\n            )\\r\\n        );\\r\\n    }\\r\\n\\r\\n    function _mint(address to, uint value) internal {\\r\\n        totalSupply = totalSupply.add(value);\\r\\n        balanceOf[to] = balanceOf[to].add(value);\\r\\n        emit Transfer(address(0), to, value);\\r\\n    }\\r\\n\\r\\n    function _burn(address from, uint value) internal {\\r\\n        balanceOf[from] = balanceOf[from].sub(value);\\r\\n        totalSupply = totalSupply.sub(value);\\r\\n        emit Transfer(from, address(0), value);\\r\\n    }\\r\\n\\r\\n    function _approve(address owner, address spender, uint value) private {\\r\\n        allowance[owner][spender] = value;\\r\\n        emit Approval(owner, spender, value);\\r\\n    }\\r\\n\\r\\n    function _transfer(address from, address to, uint value) private {\\r\\n        balanceOf[from] = balanceOf[from].sub(value);\\r\\n        balanceOf[to] = balanceOf[to].add(value);\\r\\n        emit Transfer(from, to, value);\\r\\n    }\\r\\n\\r\\n    function approve(address spender, uint value) external returns (bool) {\\r\\n        _approve(msg.sender, spender, value);\\r\\n        return true;\\r\\n    }\\r\\n\\r\\n    function transfer(address to, uint value) external returns (bool) {\\r\\n        _transfer(msg.sender, to, value);\\r\\n        return true;\\r\\n    }\\r\\n\\r\\n    function transferFrom(address from, address to, uint value) external returns (bool) {\\r\\n        if (allowance[from][msg.sender] != uint(- 1)) {\\r\\n            allowance[from][msg.sender] = allowance[from][msg.sender].sub(value);\\r\\n        }\\r\\n        _transfer(from, to, value);\\r\\n        return true;\\r\\n    }\\r\\n\\r\\n    function permit(address owner, address spender, uint value, uint deadline, uint8 v, bytes32 r, bytes32 s) external {\\r\\n        require(deadline >= block.timestamp, 'MdexSwap: EXPIRED');\\r\\n        bytes32 digest = keccak256(\\r\\n            abi.encodePacked(\\r\\n                '\\\\x19\\\\x01',\\r\\n                DOMAIN_SEPARATOR,\\r\\n                keccak256(abi.encode(PERMIT_TYPEHASH, owner, spender, value, nonces[owner]++, deadline))\\r\\n            )\\r\\n        );\\r\\n        address recoveredAddress = ecrecover(digest, v, r, s);\\r\\n        require(recoveredAddress != address(0) && recoveredAddress == owner, 'MdexSwap: INVALID_SIGNATURE');\\r\\n        _approve(owner, spender, value);\\r\\n    }\\r\\n}\\r\\n\\r\\ncontract MdexPair is IMdexPair, MdexERC20 {\\r\\n    using SafeMath  for uint;\\r\\n    using UQ112x112 for uint224;\\r\\n\\r\\n    uint public constant MINIMUM_LIQUIDITY = 10 ** 3;\\r\\n    bytes4 private constant SELECTOR = bytes4(keccak256(bytes('transfer(address,uint256)')));\\r\\n\\r\\n    address public factory;\\r\\n    address public token0;\\r\\n    address public token1;\\r\\n\\r\\n    uint112 private reserve0;           // uses single storage slot, accessible via getReserves\\r\\n    uint112 private reserve1;           // uses single storage slot, accessible via getReserves\\r\\n    uint32  private blockTimestampLast; // uses single storage slot, accessible via getReserves\\r\\n\\r\\n    uint public price0CumulativeLast;\\r\\n    uint public price1CumulativeLast;\\r\\n    uint public kLast; // reserve0 * reserve1, as of immediately after the most recent liquidity event\\r\\n\\r\\n    uint private unlocked = 1;\\r\\n    modifier lock() {\\r\\n        require(unlocked == 1, 'MdexSwap: LOCKED');\\r\\n        unlocked = 0;\\r\\n        _;\\r\\n        unlocked = 1;\\r\\n    }\\r\\n\\r\\n    function getReserves() public view returns (uint112 _reserve0, uint112 _reserve1, uint32 _blockTimestampLast) {\\r\\n        _reserve0 = reserve0;\\r\\n        _reserve1 = reserve1;\\r\\n        _blockTimestampLast = blockTimestampLast;\\r\\n    }\\r\\n\\r\\n    function _safeTransfer(address token, address to, uint value) private {\\r\\n        (bool success, bytes memory data) = token.call(abi.encodeWithSelector(SELECTOR, to, value));\\r\\n        require(success && (data.length == 0 || abi.decode(data, (bool))), 'MdexSwap: TRANSFER_FAILED');\\r\\n    }\\r\\n\\r\\n    event Mint(address indexed sender, uint amount0, uint amount1);\\r\\n    event Burn(address indexed sender, uint amount0, uint amount1, address indexed to);\\r\\n    event Swap(\\r\\n        address indexed sender,\\r\\n        uint amount0In,\\r\\n        uint amount1In,\\r\\n        uint amount0Out,\\r\\n        uint amount1Out,\\r\\n        address indexed to\\r\\n    );\\r\\n    event Sync(uint112 reserve0, uint112 reserve1);\\r\\n\\r\\n    constructor() public {\\r\\n        factory = msg.sender;\\r\\n    }\\r\\n\\r\\n    // called once by the factory at time of deployment\\r\\n    function initialize(address _token0, address _token1) external {\\r\\n        require(msg.sender == factory, 'MdexSwap: FORBIDDEN');\\r\\n        // sufficient check\\r\\n        token0 = _token0;\\r\\n        token1 = _token1;\\r\\n    }\\r\\n\\r\\n    // update reserves and, on the first call per block, price accumulators\\r\\n    function _update(uint balance0, uint balance1, uint112 _reserve0, uint112 _reserve1) private {\\r\\n        require(balance0 <= uint112(- 1) && balance1 <= uint112(- 1), 'MdexSwap: OVERFLOW');\\r\\n        uint32 blockTimestamp = uint32(block.timestamp % 2 ** 32);\\r\\n        uint32 timeElapsed = blockTimestamp - blockTimestampLast;\\r\\n        // overflow is desired\\r\\n        if (timeElapsed > 0 && _reserve0 != 0 && _reserve1 != 0) {\\r\\n            // * never overflows, and + overflow is desired\\r\\n            price0CumulativeLast += uint(UQ112x112.encode(_reserve1).uqdiv(_reserve0)) * timeElapsed;\\r\\n            price1CumulativeLast += uint(UQ112x112.encode(_reserve0).uqdiv(_reserve1)) * timeElapsed;\\r\\n        }\\r\\n        reserve0 = uint112(balance0);\\r\\n        reserve1 = uint112(balance1);\\r\\n        blockTimestampLast = blockTimestamp;\\r\\n        emit Sync(reserve0, reserve1);\\r\\n    }\\r\\n\\r\\n    // if fee is on, mint liquidity equivalent to 1/6th of the growth in sqrt(k)\\r\\n    function _mintFee(uint112 _reserve0, uint112 _reserve1) private returns (bool feeOn) {\\r\\n        address feeTo = IMdexFactory(factory).feeTo();\\r\\n        feeOn = feeTo != address(0);\\r\\n        uint _kLast = kLast;\\r\\n        // gas savings\\r\\n        if (feeOn) {\\r\\n            if (_kLast != 0) {\\r\\n                uint rootK = SafeMath.sqrt(uint(_reserve0).mul(_reserve1));\\r\\n                uint rootKLast = SafeMath.sqrt(_kLast);\\r\\n                if (rootK > rootKLast) {\\r\\n                    uint numerator = totalSupply.mul(rootK.sub(rootKLast));\\r\\n                    uint denominator = rootK.mul(IMdexFactory(factory).feeToRate()).add(rootKLast);\\r\\n                    uint liquidity = numerator / denominator;\\r\\n                    if (liquidity > 0) _mint(feeTo, liquidity);\\r\\n                }\\r\\n            }\\r\\n        } else if (_kLast != 0) {\\r\\n            kLast = 0;\\r\\n        }\\r\\n    }\\r\\n\\r\\n    // this low-level function should be called from a contract which performs important safety checks\\r\\n    function mint(address to) external lock returns (uint liquidity) {\\r\\n        (uint112 _reserve0, uint112 _reserve1,) = getReserves();\\r\\n        // gas savings\\r\\n        uint balance0 = IERC20(token0).balanceOf(address(this));\\r\\n        uint balance1 = IERC20(token1).balanceOf(address(this));\\r\\n        uint amount0 = balance0.sub(_reserve0);\\r\\n        uint amount1 = balance1.sub(_reserve1);\\r\\n\\r\\n        bool feeOn = _mintFee(_reserve0, _reserve1);\\r\\n        uint _totalSupply = totalSupply;\\r\\n        // gas savings, must be defined here since totalSupply can update in _mintFee\\r\\n        if (_totalSupply == 0) {\\r\\n            liquidity = SafeMath.sqrt(amount0.mul(amount1)).sub(MINIMUM_LIQUIDITY);\\r\\n            _mint(address(0), MINIMUM_LIQUIDITY);\\r\\n            // permanently lock the first MINIMUM_LIQUIDITY tokens\\r\\n        } else {\\r\\n            liquidity = SafeMath.min(amount0.mul(_totalSupply) / _reserve0, amount1.mul(_totalSupply) / _reserve1);\\r\\n        }\\r\\n        require(liquidity > 0, 'MdexSwap: INSUFFICIENT_LIQUIDITY_MINTED');\\r\\n        _mint(to, liquidity);\\r\\n\\r\\n        _update(balance0, balance1, _reserve0, _reserve1);\\r\\n        if (feeOn) kLast = uint(reserve0).mul(reserve1);\\r\\n        // reserve0 and reserve1 are up-to-date\\r\\n        emit Mint(msg.sender, amount0, amount1);\\r\\n    }\\r\\n\\r\\n    // this low-level function should be called from a contract which performs important safety checks\\r\\n    function burn(address to) external lock returns (uint amount0, uint amount1) {\\r\\n        (uint112 _reserve0, uint112 _reserve1,) = getReserves();\\r\\n        // gas savings\\r\\n        address _token0 = token0;\\r\\n        // gas savings\\r\\n        address _token1 = token1;\\r\\n        // gas savings\\r\\n        uint balance0 = IERC20(_token0).balanceOf(address(this));\\r\\n        uint balance1 = IERC20(_token1).balanceOf(address(this));\\r\\n        uint liquidity = balanceOf[address(this)];\\r\\n\\r\\n        bool feeOn = _mintFee(_reserve0, _reserve1);\\r\\n        uint _totalSupply = totalSupply;\\r\\n        // gas savings, must be defined here since totalSupply can update in _mintFee\\r\\n        amount0 = liquidity.mul(balance0) / _totalSupply;\\r\\n        // using balances ensures pro-rata distribution\\r\\n        amount1 = liquidity.mul(balance1) / _totalSupply;\\r\\n        // using balances ensures pro-rata distribution\\r\\n        require(amount0 > 0 && amount1 > 0, 'MdexSwap: INSUFFICIENT_LIQUIDITY_BURNED');\\r\\n        _burn(address(this), liquidity);\\r\\n        _safeTransfer(_token0, to, amount0);\\r\\n        _safeTransfer(_token1, to, amount1);\\r\\n        balance0 = IERC20(_token0).balanceOf(address(this));\\r\\n        balance1 = IERC20(_token1).balanceOf(address(this));\\r\\n\\r\\n        _update(balance0, balance1, _reserve0, _reserve1);\\r\\n        if (feeOn) kLast = uint(reserve0).mul(reserve1);\\r\\n        // reserve0 and reserve1 are up-to-date\\r\\n        emit Burn(msg.sender, amount0, amount1, to);\\r\\n    }\\r\\n\\r\\n    // this low-level function should be called from a contract which performs important safety checks\\r\\n    function swap(uint amount0Out, uint amount1Out, address to, bytes calldata data) external lock {\\r\\n        require(amount0Out > 0 || amount1Out > 0, 'MdexSwap: INSUFFICIENT_OUTPUT_AMOUNT');\\r\\n        (uint112 _reserve0, uint112 _reserve1,) = getReserves();\\r\\n        // gas savings\\r\\n        require(amount0Out < _reserve0 && amount1Out < _reserve1, 'MdexSwap: INSUFFICIENT_LIQUIDITY');\\r\\n\\r\\n        uint balance0;\\r\\n        uint balance1;\\r\\n        {// scope for _token{0,1}, avoids stack too deep errors\\r\\n            address _token0 = token0;\\r\\n            address _token1 = token1;\\r\\n            require(to != _token0 && to != _token1, 'MdexSwap: INVALID_TO');\\r\\n            if (amount0Out > 0) _safeTransfer(_token0, to, amount0Out);\\r\\n            // optimistically transfer tokens\\r\\n            if (amount1Out > 0) _safeTransfer(_token1, to, amount1Out);\\r\\n            // optimistically transfer tokens\\r\\n            if (data.length > 0) IHswapV2Callee(to).hswapV2Call(msg.sender, amount0Out, amount1Out, data);\\r\\n            balance0 = IERC20(_token0).balanceOf(address(this));\\r\\n            balance1 = IERC20(_token1).balanceOf(address(this));\\r\\n        }\\r\\n        uint amount0In = balance0 > _reserve0 - amount0Out ? balance0 - (_reserve0 - amount0Out) : 0;\\r\\n        uint amount1In = balance1 > _reserve1 - amount1Out ? balance1 - (_reserve1 - amount1Out) : 0;\\r\\n        require(amount0In > 0 || amount1In > 0, 'MdexSwap: INSUFFICIENT_INPUT_AMOUNT');\\r\\n        {// scope for reserve{0,1}Adjusted, avoids stack too deep errors\\r\\n            uint balance0Adjusted = balance0.mul(1000).sub(amount0In.mul(3));\\r\\n            uint balance1Adjusted = balance1.mul(1000).sub(amount1In.mul(3));\\r\\n            require(balance0Adjusted.mul(balance1Adjusted) >= uint(_reserve0).mul(_reserve1).mul(1000 ** 2), 'MdexSwap: K');\\r\\n        }\\r\\n\\r\\n        _update(balance0, balance1, _reserve0, _reserve1);\\r\\n        emit Swap(msg.sender, amount0In, amount1In, amount0Out, amount1Out, to);\\r\\n    }\\r\\n\\r\\n    // force balances to match reserves\\r\\n    function skim(address to) external lock {\\r\\n        address _token0 = token0;\\r\\n        // gas savings\\r\\n        address _token1 = token1;\\r\\n        // gas savings\\r\\n        _safeTransfer(_token0, to, IERC20(_token0).balanceOf(address(this)).sub(reserve0));\\r\\n        _safeTransfer(_token1, to, IERC20(_token1).balanceOf(address(this)).sub(reserve1));\\r\\n    }\\r\\n\\r\\n    // force reserves to match balances\\r\\n    function sync() external lock {\\r\\n        _update(IERC20(token0).balanceOf(address(this)), IERC20(token1).balanceOf(address(this)), reserve0, reserve1);\\r\\n    }\\r\\n\\r\\n    function price(address token, uint256 baseDecimal) public view returns (uint256) {\\r\\n        if ((token0 != token && token1 != token) || 0 == reserve0 || 0 == reserve1) {\\r\\n            return 0;\\r\\n        }\\r\\n        if (token0 == token) {\\r\\n            return uint256(reserve1).mul(baseDecimal).div(uint256(reserve0));\\r\\n        } else {\\r\\n            return uint256(reserve0).mul(baseDecimal).div(uint256(reserve1));\\r\\n        }\\r\\n    }\\r\\n\\r\\n}\\r\\n\\r\\ncontract MdexFactory is IMdexFactory {\\r\\n    using SafeMath for uint256;\\r\\n    address public feeTo;\\r\\n    address public feeToSetter;\\r\\n    uint256 public feeToRate;\\r\\n    bytes32 public initCodeHash;\\r\\n    bool public initCode = false;\\r\\n\\r\\n    mapping(address => mapping(address => address)) public getPair;\\r\\n    address[] public allPairs;\\r\\n\\r\\n    event PairCreated(address indexed token0, address indexed token1, address pair, uint);\\r\\n\\r\\n    constructor(address _feeToSetter) public {\\r\\n        feeToSetter = _feeToSetter;\\r\\n    }\\r\\n\\r\\n    function allPairsLength() external view returns (uint) {\\r\\n        return allPairs.length;\\r\\n    }\\r\\n\\r\\n    function createPair(address tokenA, address tokenB) external returns (address pair) {\\r\\n        require(tokenA != tokenB, 'SwapFactory: IDENTICAL_ADDRESSES');\\r\\n        (address token0, address token1) = tokenA < tokenB ? (tokenA, tokenB) : (tokenB, tokenA);\\r\\n        require(token0 != address(0), 'MdexSwapFactory: ZERO_ADDRESS');\\r\\n        require(getPair[token0][token1] == address(0), 'MdexSwapFactory: PAIR_EXISTS');\\r\\n        // single check is sufficient\\r\\n        bytes memory bytecode = type(MdexPair).creationCode;\\r\\n        bytes32 salt = keccak256(abi.encodePacked(token0, token1));\\r\\n        assembly {\\r\\n            pair := create2(0, add(bytecode, 32), mload(bytecode), salt)\\r\\n        }\\r\\n        IMdexPair(pair).initialize(token0, token1);\\r\\n        getPair[token0][token1] = pair;\\r\\n        getPair[token1][token0] = pair;\\r\\n        // populate mapping in the reverse direction\\r\\n        allPairs.push(pair);\\r\\n        emit PairCreated(token0, token1, pair, allPairs.length);\\r\\n    }\\r\\n\\r\\n    function setFeeTo(address _feeTo) external {\\r\\n        require(msg.sender == feeToSetter, 'MdexSwapFactory: FORBIDDEN');\\r\\n        feeTo = _feeTo;\\r\\n    }\\r\\n\\r\\n    function setFeeToSetter(address _feeToSetter) external {\\r\\n        require(msg.sender == feeToSetter, 'MdexSwapFactory: FORBIDDEN');\\r\\n        require(_feeToSetter != address(0), \\\"MdexSwapFactory: FeeToSetter is zero address\\\");\\r\\n        feeToSetter = _feeToSetter;\\r\\n    }\\r\\n\\r\\n    function setFeeToRate(uint256 _rate) external {\\r\\n        require(msg.sender == feeToSetter, 'MdexSwapFactory: FORBIDDEN');\\r\\n        require(_rate > 0, \\\"MdexSwapFactory: FEE_TO_RATE_OVERFLOW\\\");\\r\\n        feeToRate = _rate.sub(1);\\r\\n    }\\r\\n\\r\\n    function setInitCodeHash(bytes32 _initCodeHash) external {\\r\\n        require(msg.sender == feeToSetter, 'MdexSwapFactory: FORBIDDEN');\\r\\n        require(initCode == false, \\\"MdexSwapFactory: Do not repeat settings initCodeHash\\\");\\r\\n        initCodeHash = _initCodeHash;\\r\\n        initCode = true;\\r\\n    }\\r\\n\\r\\n    // returns sorted token addresses, used to handle return values from pairs sorted in this order\\r\\n    function sortTokens(address tokenA, address tokenB) public pure returns (address token0, address token1) {\\r\\n        require(tokenA != tokenB, 'MdexSwapFactory: IDENTICAL_ADDRESSES');\\r\\n        (token0, token1) = tokenA < tokenB ? (tokenA, tokenB) : (tokenB, tokenA);\\r\\n        require(token0 != address(0), 'MdexSwapFactory: ZERO_ADDRESS');\\r\\n    }\\r\\n\\r\\n\\r\\n    function getInitCodeHash() public pure returns (bytes32) {\\r\\n        return keccak256(abi.encodePacked(type(MdexPair).creationCode));\\r\\n    }\\r\\n\\r\\n    // calculates the CREATE2 address for a pair without making any external calls\\r\\n    function pairFor(address tokenA, address tokenB) public view returns (address pair) {\\r\\n        (address token0, address token1) = sortTokens(tokenA, tokenB);\\r\\n        pair = address(uint(keccak256(abi.encodePacked(\\r\\n                hex'ff',\\r\\n                address(this),\\r\\n                keccak256(abi.encodePacked(token0, token1)),\\r\\n                initCodeHash\\r\\n            ))));\\r\\n    }\\r\\n    // fetches and sorts the reserves for a pair\\r\\n    function getReserves(address tokenA, address tokenB) public view returns (uint reserveA, uint reserveB) {\\r\\n        (address token0,) = sortTokens(tokenA, tokenB);\\r\\n        (uint reserve0, uint reserve1,) = IMdexPair(pairFor(tokenA, tokenB)).getReserves();\\r\\n        (reserveA, reserveB) = tokenA == token0 ? (reserve0, reserve1) : (reserve1, reserve0);\\r\\n    }\\r\\n\\r\\n    // given some amount of an asset and pair reserves, returns an equivalent amount of the other asset\\r\\n    function quote(uint amountA, uint reserveA, uint reserveB) public pure returns (uint amountB) {\\r\\n        require(amountA > 0, 'MdexSwapFactory: INSUFFICIENT_AMOUNT');\\r\\n        require(reserveA > 0 && reserveB > 0, 'MdexSwapFactory: INSUFFICIENT_LIQUIDITY');\\r\\n        amountB = amountA.mul(reserveB) / reserveA;\\r\\n    }\\r\\n\\r\\n    // given an input amount of an asset and pair reserves, returns the maximum output amount of the other asset\\r\\n    function getAmountOut(uint amountIn, uint reserveIn, uint reserveOut) public view returns (uint amountOut) {\\r\\n        require(amountIn > 0, 'MdexSwapFactory: INSUFFICIENT_INPUT_AMOUNT');\\r\\n        require(reserveIn > 0 && reserveOut > 0, 'MdexSwapFactory: INSUFFICIENT_LIQUIDITY');\\r\\n        uint amountInWithFee = amountIn.mul(997);\\r\\n        uint numerator = amountInWithFee.mul(reserveOut);\\r\\n        uint denominator = reserveIn.mul(1000).add(amountInWithFee);\\r\\n        amountOut = numerator / denominator;\\r\\n    }\\r\\n\\r\\n    // given an output amount of an asset and pair reserves, returns a required input amount of the other asset\\r\\n    function getAmountIn(uint amountOut, uint reserveIn, uint reserveOut) public view returns (uint amountIn) {\\r\\n        require(amountOut > 0, 'MdexSwapFactory: INSUFFICIENT_OUTPUT_AMOUNT');\\r\\n        require(reserveIn > 0 && reserveOut > 0, 'MdexSwapFactory: INSUFFICIENT_LIQUIDITY');\\r\\n        uint numerator = reserveIn.mul(amountOut).mul(1000);\\r\\n        uint denominator = reserveOut.sub(amountOut).mul(997);\\r\\n        amountIn = (numerator / denominator).add(1);\\r\\n    }\\r\\n\\r\\n    // performs chained getAmountOut calculations on any number of pairs\\r\\n    function getAmountsOut(uint amountIn, address[] memory path) public view returns (uint[] memory amounts) {\\r\\n        require(path.length >= 2, 'MdexSwapFactory: INVALID_PATH');\\r\\n        amounts = new uint[](path.length);\\r\\n        amounts[0] = amountIn;\\r\\n        for (uint i; i < path.length - 1; i++) {\\r\\n            (uint reserveIn, uint reserveOut) = getReserves(path[i], path[i + 1]);\\r\\n            amounts[i + 1] = getAmountOut(amounts[i], reserveIn, reserveOut);\\r\\n        }\\r\\n    }\\r\\n\\r\\n    // performs chained getAmountIn calculations on any number of pairs\\r\\n    function getAmountsIn(uint amountOut, address[] memory path) public view returns (uint[] memory amounts) {\\r\\n        require(path.length >= 2, 'MdexSwapFactory: INVALID_PATH');\\r\\n        amounts = new uint[](path.length);\\r\\n        amounts[amounts.length - 1] = amountOut;\\r\\n        for (uint i = path.length - 1; i > 0; i--) {\\r\\n            (uint reserveIn, uint reserveOut) = getReserves(path[i - 1], path[i]);\\r\\n            amounts[i - 1] = getAmountIn(amounts[i], reserveIn, reserveOut);\\r\\n        }\\r\\n    }\\r\\n}\\r\\n\\r\\nlibrary SafeMath {\\r\\n    uint256 constant WAD = 10 ** 18;\\r\\n    uint256 constant RAY = 10 ** 27;\\r\\n\\r\\n    function wad() public pure returns (uint256) {\\r\\n        return WAD;\\r\\n    }\\r\\n\\r\\n    function ray() public pure returns (uint256) {\\r\\n        return RAY;\\r\\n    }\\r\\n\\r\\n    function add(uint256 a, uint256 b) internal pure returns (uint256) {\\r\\n        uint256 c = a + b;\\r\\n        require(c >= a, \\\"SafeMath: addition overflow\\\");\\r\\n\\r\\n        return c;\\r\\n    }\\r\\n\\r\\n    function sub(uint256 a, uint256 b) internal pure returns (uint256) {\\r\\n        return sub(a, b, \\\"SafeMath: subtraction overflow\\\");\\r\\n    }\\r\\n\\r\\n    function sub(uint256 a, uint256 b, string memory errorMessage) internal pure returns (uint256) {\\r\\n        require(b <= a, errorMessage);\\r\\n        uint256 c = a - b;\\r\\n\\r\\n        return c;\\r\\n    }\\r\\n\\r\\n    function mul(uint256 a, uint256 b) internal pure returns (uint256) {\\r\\n        // Gas optimization: this is cheaper than requiring 'a' not being zero, but the\\r\\n        // benefit is lost if 'b' is also tested.\\r\\n        // See: https://github.com/OpenZeppelin/openzeppelin-contracts/pull/522\\r\\n        if (a == 0) {\\r\\n            return 0;\\r\\n        }\\r\\n\\r\\n        uint256 c = a * b;\\r\\n        require(c / a == b, \\\"SafeMath: multiplication overflow\\\");\\r\\n\\r\\n        return c;\\r\\n    }\\r\\n\\r\\n    function div(uint256 a, uint256 b) internal pure returns (uint256) {\\r\\n        return div(a, b, \\\"SafeMath: division by zero\\\");\\r\\n    }\\r\\n\\r\\n    function div(uint256 a, uint256 b, string memory errorMessage) internal pure returns (uint256) {\\r\\n        // Solidity only automatically asserts when dividing by 0\\r\\n        require(b > 0, errorMessage);\\r\\n        uint256 c = a / b;\\r\\n        // assert(a == b * c + a % b); // There is no case in which this doesn't hold\\r\\n\\r\\n        return c;\\r\\n    }\\r\\n\\r\\n    function mod(uint256 a, uint256 b) internal pure returns (uint256) {\\r\\n        return mod(a, b, \\\"SafeMath: modulo by zero\\\");\\r\\n    }\\r\\n\\r\\n    function mod(uint256 a, uint256 b, string memory errorMessage) internal pure returns (uint256) {\\r\\n        require(b != 0, errorMessage);\\r\\n        return a % b;\\r\\n    }\\r\\n\\r\\n    function min(uint256 a, uint256 b) internal pure returns (uint256) {\\r\\n        return a <= b ? a : b;\\r\\n    }\\r\\n\\r\\n    function max(uint256 a, uint256 b) internal pure returns (uint256) {\\r\\n        return a >= b ? a : b;\\r\\n    }\\r\\n\\r\\n    function sqrt(uint256 a) internal pure returns (uint256 b) {\\r\\n        if (a > 3) {\\r\\n            b = a;\\r\\n            uint256 x = a / 2 + 1;\\r\\n            while (x < b) {\\r\\n                b = x;\\r\\n                x = (a / x + x) / 2;\\r\\n            }\\r\\n        } else if (a != 0) {\\r\\n            b = 1;\\r\\n        }\\r\\n    }\\r\\n\\r\\n    function wmul(uint256 a, uint256 b) internal pure returns (uint256) {\\r\\n        return mul(a, b) / WAD;\\r\\n    }\\r\\n\\r\\n    function wmulRound(uint256 a, uint256 b) internal pure returns (uint256) {\\r\\n        return add(mul(a, b), WAD / 2) / WAD;\\r\\n    }\\r\\n\\r\\n    function rmul(uint256 a, uint256 b) internal pure returns (uint256) {\\r\\n        return mul(a, b) / RAY;\\r\\n    }\\r\\n\\r\\n    function rmulRound(uint256 a, uint256 b) internal pure returns (uint256) {\\r\\n        return add(mul(a, b), RAY / 2) / RAY;\\r\\n    }\\r\\n\\r\\n    function wdiv(uint256 a, uint256 b) internal pure returns (uint256) {\\r\\n        return div(mul(a, WAD), b);\\r\\n    }\\r\\n\\r\\n    function wdivRound(uint256 a, uint256 b) internal pure returns (uint256) {\\r\\n        return add(mul(a, WAD), b / 2) / b;\\r\\n    }\\r\\n\\r\\n    function rdiv(uint256 a, uint256 b) internal pure returns (uint256) {\\r\\n        return div(mul(a, RAY), b);\\r\\n    }\\r\\n\\r\\n    function rdivRound(uint256 a, uint256 b) internal pure returns (uint256) {\\r\\n        return add(mul(a, RAY), b / 2) / b;\\r\\n    }\\r\\n\\r\\n    function wpow(uint256 x, uint256 n) internal pure returns (uint256) {\\r\\n        uint256 result = WAD;\\r\\n        while (n > 0) {\\r\\n            if (n % 2 != 0) {\\r\\n                result = wmul(result, x);\\r\\n            }\\r\\n            x = wmul(x, x);\\r\\n            n /= 2;\\r\\n        }\\r\\n        return result;\\r\\n    }\\r\\n\\r\\n    function rpow(uint256 x, uint256 n) internal pure returns (uint256) {\\r\\n        uint256 result = RAY;\\r\\n        while (n > 0) {\\r\\n            if (n % 2 != 0) {\\r\\n                result = rmul(result, x);\\r\\n            }\\r\\n            x = rmul(x, x);\\r\\n            n /= 2;\\r\\n        }\\r\\n        return result;\\r\\n    }\\r\\n}\\r\\n\\r\\n// a library for handling binary fixed point numbers (https://en.wikipedia.org/wiki/Q_(number_format))\\r\\n\\r\\n// range: [0, 2**112 - 1]\\r\\n// resolution: 1 / 2**112\\r\\n\\r\\nlibrary UQ112x112 {\\r\\n    uint224 constant Q112 = 2 ** 112;\\r\\n\\r\\n    // encode a uint112 as a UQ112x112\\r\\n    function encode(uint112 y) internal pure returns (uint224 z) {\\r\\n        z = uint224(y) * Q112;\\r\\n        // never overflows\\r\\n    }\\r\\n\\r\\n    // divide a UQ112x112 by a uint112, returning a UQ112x112\\r\\n    function uqdiv(uint224 x, uint112 y) internal pure returns (uint224 z) {\\r\\n        z = x / uint224(y);\\r\\n    }\\r\\n}\\r\\n\",\"keccak256\":\"0x5877aa180c6988e739fee82419f7fc5265093e5926762cbe1293dea69cf79369\"}},\"version\":1}",
  "bytecode": "0x60806040526001600c5534801561001557600080fd5b5060405146908060526126758239604080519182900360520182208282018252600e83526d2429bbb0b8102628102a37b5b2b760911b6020938401528151808301835260018152603160f81b908401528151808401919091527f87dad95daa867d5e0494900019e929bdf17f889d19a25c4156e2329f51c7c345818301527fc89efdaa54c0f20c7adf612882df0950f5a951637e0307cdcb4c672f298b8bc6606082015260808101949094523060a0808601919091528151808603909101815260c09094019052825192019190912060035550600580546001600160a01b0319163317905561256c806101096000396000f3fe608060405234801561001057600080fd5b50600436106101c45760003560e01c806370a08231116100f9578063ba9a7a5611610097578063d21220a711610071578063d21220a71461057b578063d505accf14610583578063dd62ed3e146105d4578063fff6cae914610602576101c4565b8063ba9a7a5614610545578063bc25cf771461054d578063c45a015514610573576101c4565b806389afcb44116100d357806389afcb44146104a657806395d89b41146104e5578063a9059cbb146104ed578063ad9b802414610519576101c4565b806370a08231146104525780637464fc3d146104785780637ecebe0014610480576101c4565b806330adf81f11610166578063485cc95511610140578063485cc955146103ee5780635909c0d51461041c5780635a3d5493146104245780636a6278421461042c576101c4565b806330adf81f146103c0578063313ce567146103c85780633644e515146103e6576101c4565b8063095ea7b3116101a2578063095ea7b31461030c5780630dfe16811461034c57806318160ddd1461037057806323b872dd1461038a576101c4565b8063022c0d9f146101c957806306fdde03146102575780630902f1ac146102d4575b600080fd5b610255600480360360808110156101df57600080fd5b8135916020810135916001600160a01b03604083013516919081019060808101606082013564010000000081111561021657600080fd5b82018360208201111561022857600080fd5b8035906020019184600183028401116401000000008311171561024a57600080fd5b50909250905061060a565b005b61025f610b58565b6040805160208082528351818301528351919283929083019185019080838360005b83811015610299578181015183820152602001610281565b50505050905090810190601f1680156102c65780820380516001836020036101000a031916815260200191505b509250505060405180910390f35b6102dc610b82565b604080516001600160701b03948516815292909316602083015263ffffffff168183015290519081900360600190f35b6103386004803603604081101561032257600080fd5b506001600160a01b038135169060200135610bac565b604080519115158252519081900360200190f35b610354610bc3565b604080516001600160a01b039092168252519081900360200190f35b610378610bd2565b60408051918252519081900360200190f35b610338600480360360608110156103a057600080fd5b506001600160a01b03813581169160208101359091169060400135610bd8565b610378610c72565b6103d0610c96565b6040805160ff9092168252519081900360200190f35b610378610c9b565b6102556004803603604081101561040457600080fd5b506001600160a01b0381358116916020013516610ca1565b610378610d24565b610378610d2a565b6103786004803603602081101561044257600080fd5b50356001600160a01b0316610d30565b6103786004803603602081101561046857600080fd5b50356001600160a01b031661102f565b610378611041565b6103786004803603602081101561049657600080fd5b50356001600160a01b0316611047565b6104cc600480360360208110156104bc57600080fd5b50356001600160a01b0316611059565b6040805192835260208301919091528051918290030190f35b61025f6113fe565b6103386004803603604081101561050357600080fd5b506001600160a01b03813516906020013561141e565b6103786004803603604081101561052f57600080fd5b506001600160a01b03813516906020013561142b565b610378611515565b6102556004803603602081101561056357600080fd5b50356001600160a01b031661151b565b610354611685565b610354611694565b610255600480360360e081101561059957600080fd5b506001600160a01b03813581169160208101359091169060408101359060608101359060ff6080820135169060a08101359060c001356116a3565b610378600480360360408110156105ea57600080fd5b506001600160a01b03813581169160200135166118a4565b6102556118c1565b600c54600114610654576040805162461bcd60e51b815260206004820152601060248201526f1359195e14ddd85c0e881313d0d2d15160821b604482015290519081900360640190fd5b6000600c55841515806106675750600084115b6106a25760405162461bcd60e51b81526004018080602001828103825260248152602001806124a96024913960400191505060405180910390fd5b6000806106ad610b82565b5091509150816001600160701b0316871080156106d25750806001600160701b031686105b610723576040805162461bcd60e51b815260206004820181905260248201527f4d646578537761703a20494e53554646494349454e545f4c4951554944495459604482015290519081900360640190fd5b60065460075460009182916001600160a01b039182169190811690891682148015906107615750806001600160a01b0316896001600160a01b031614155b6107a9576040805162461bcd60e51b81526020600482015260146024820152734d646578537761703a20494e56414c49445f544f60601b604482015290519081900360640190fd5b8a156107ba576107ba828a8d611a22565b89156107cb576107cb818a8c611a22565b861561088657886001600160a01b031663226dc882338d8d8c8c6040518663ffffffff1660e01b815260040180866001600160a01b03166001600160a01b03168152602001858152602001848152602001806020018281038252848482818152602001925080828437600081840152601f19601f8201169050808301925050509650505050505050600060405180830381600087803b15801561086d57600080fd5b505af1158015610881573d6000803e3d6000fd5b505050505b604080516370a0823160e01b815230600482015290516001600160a01b038416916370a08231916024808301926020929190829003018186803b1580156108cc57600080fd5b505afa1580156108e0573d6000803e3d6000fd5b505050506040513d60208110156108f657600080fd5b5051604080516370a0823160e01b815230600482015290519195506001600160a01b038316916370a0823191602480820192602092909190829003018186803b15801561094257600080fd5b505afa158015610956573d6000803e3d6000fd5b505050506040513d602081101561096c57600080fd5b5051925060009150506001600160701b0385168a9003831161098f57600061099e565b89856001600160701b03160383035b9050600089856001600160701b03160383116109bb5760006109ca565b89856001600160701b03160383035b905060008211806109db5750600081115b610a165760405162461bcd60e51b81526004018080602001828103825260238152602001806124ee6023913960400191505060405180910390fd5b6000610a4a610a2c84600363ffffffff611bbc16565b610a3e876103e863ffffffff611bbc16565b9063ffffffff611c1c16565b90506000610a62610a2c84600363ffffffff611bbc16565b9050610a93620f4240610a876001600160701b038b8116908b1663ffffffff611bbc16565b9063ffffffff611bbc16565b610aa3838363ffffffff611bbc16565b1015610ae4576040805162461bcd60e51b815260206004820152600b60248201526a4d646578537761703a204b60a81b604482015290519081900360640190fd5b5050610af284848888611c5e565b60408051838152602081018390528082018d9052606081018c905290516001600160a01b038b169133917fd78ad95fa46c994b6551d0da85fc275fe613ce37657fb8d5e3d130840159d8229181900360800190a350506001600c55505050505050505050565b6040518060400160405280600e81526020016d2429bbb0b8102628102a37b5b2b760911b81525081565b6008546001600160701b0380821692600160701b830490911691600160e01b900463ffffffff1690565b6000610bb9338484611e22565b5060015b92915050565b6006546001600160a01b031681565b60005481565b6001600160a01b038316600090815260026020908152604080832033845290915281205460001914610c5d576001600160a01b0384166000908152600260209081526040808320338452909152902054610c38908363ffffffff611c1c16565b6001600160a01b03851660009081526002602090815260408083203384529091529020555b610c68848484611e84565b5060019392505050565b7f6e71edae12b1b97f4d1f60370fef10105fa2faae0126114a169c64845d6126c981565b601281565b60035481565b6005546001600160a01b03163314610cf6576040805162461bcd60e51b815260206004820152601360248201527226b232bc29bbb0b81d102327a92124a22222a760691b604482015290519081900360640190fd5b600680546001600160a01b039384166001600160a01b03199182161790915560078054929093169116179055565b60095481565b600a5481565b6000600c54600114610d7c576040805162461bcd60e51b815260206004820152601060248201526f1359195e14ddd85c0e881313d0d2d15160821b604482015290519081900360640190fd5b6000600c81905580610d8c610b82565b50600654604080516370a0823160e01b815230600482015290519395509193506000926001600160a01b03909116916370a08231916024808301926020929190829003018186803b158015610de057600080fd5b505afa158015610df4573d6000803e3d6000fd5b505050506040513d6020811015610e0a57600080fd5b5051600754604080516370a0823160e01b815230600482015290519293506000926001600160a01b03909216916370a0823191602480820192602092909190829003018186803b158015610e5d57600080fd5b505afa158015610e71573d6000803e3d6000fd5b505050506040513d6020811015610e8757600080fd5b505190506000610ea6836001600160701b03871663ffffffff611c1c16565b90506000610ec3836001600160701b03871663ffffffff611c1c16565b90506000610ed18787611f3e565b60005490915080610f0e57610efa6103e8610a3e610ef5878763ffffffff611bbc16565b612115565b9850610f0960006103e8612167565b610f5d565b610f5a6001600160701b038916610f2b868463ffffffff611bbc16565b81610f3257fe5b046001600160701b038916610f4d868563ffffffff611bbc16565b81610f5457fe5b046121fd565b98505b60008911610f9c5760405162461bcd60e51b81526004018080602001828103825260278152602001806125116027913960400191505060405180910390fd5b610fa68a8a612167565b610fb286868a8a611c5e565b8115610fe257600854610fde906001600160701b0380821691600160701b90041663ffffffff611bbc16565b600b555b6040805185815260208101859052815133927f4c209b5fc8ad50758f13e2e1088ba56a560dff690a1c6fef26394f4c03821c4f928290030190a250506001600c5550949695505050505050565b60016020526000908152604090205481565b600b5481565b60046020526000908152604090205481565b600080600c546001146110a6576040805162461bcd60e51b815260206004820152601060248201526f1359195e14ddd85c0e881313d0d2d15160821b604482015290519081900360640190fd5b6000600c819055806110b6610b82565b50600654600754604080516370a0823160e01b815230600482015290519496509294506001600160a01b039182169391169160009184916370a08231916024808301926020929190829003018186803b15801561111257600080fd5b505afa158015611126573d6000803e3d6000fd5b505050506040513d602081101561113c57600080fd5b5051604080516370a0823160e01b815230600482015290519192506000916001600160a01b038516916370a08231916024808301926020929190829003018186803b15801561118a57600080fd5b505afa15801561119e573d6000803e3d6000fd5b505050506040513d60208110156111b457600080fd5b5051306000908152600160205260408120549192506111d38888611f3e565b600054909150806111ea848763ffffffff611bbc16565b816111f157fe5b049a5080611205848663ffffffff611bbc16565b8161120c57fe5b04995060008b11801561121f575060008a115b61125a5760405162461bcd60e51b81526004018080602001828103825260278152602001806124826027913960400191505060405180910390fd5b6112643084612214565b61126f878d8d611a22565b61127a868d8c611a22565b604080516370a0823160e01b815230600482015290516001600160a01b038916916370a08231916024808301926020929190829003018186803b1580156112c057600080fd5b505afa1580156112d4573d6000803e3d6000fd5b505050506040513d60208110156112ea57600080fd5b5051604080516370a0823160e01b815230600482015290519196506001600160a01b038816916370a0823191602480820192602092909190829003018186803b15801561133657600080fd5b505afa15801561134a573d6000803e3d6000fd5b505050506040513d602081101561136057600080fd5b5051935061137085858b8b611c5e565b81156113a05760085461139c906001600160701b0380821691600160701b90041663ffffffff611bbc16565b600b555b604080518c8152602081018c905281516001600160a01b038f169233927fdccd412f0b1252819cb1fd330b93224ca42612892bb3f4f789976e6d81936496929081900390910190a35050505050505050506001600c81905550915091565b604051806040016040528060048152602001630909a88b60e31b81525081565b6000610bb9338484611e84565b6006546000906001600160a01b0384811691161480159061145a57506007546001600160a01b03848116911614155b8061146e57506008546001600160701b0316155b806114895750600854600160701b90046001600160701b0316155b1561149657506000610bbd565b6006546001600160a01b03848116911614156114eb576008546114e4906001600160701b03808216916114d891600160701b909104168563ffffffff611bbc16565b9063ffffffff6122b216565b9050610bbd565b6008546114e4906001600160701b03600160701b82048116916114d891168563ffffffff611bbc16565b6103e881565b600c54600114611565576040805162461bcd60e51b815260206004820152601060248201526f1359195e14ddd85c0e881313d0d2d15160821b604482015290519081900360640190fd5b6000600c55600654600754600854604080516370a0823160e01b815230600482015290516001600160a01b039485169490931692611614928592879261160f926001600160701b03169185916370a0823191602480820192602092909190829003018186803b1580156115d757600080fd5b505afa1580156115eb573d6000803e3d6000fd5b505050506040513d602081101561160157600080fd5b50519063ffffffff611c1c16565b611a22565b600854604080516370a0823160e01b8152306004820152905161167b928492879261160f92600160701b90046001600160701b0316916001600160a01b038616916370a0823191602480820192602092909190829003018186803b1580156115d757600080fd5b50506001600c5550565b6005546001600160a01b031681565b6007546001600160a01b031681565b428410156116ec576040805162461bcd60e51b81526020600482015260116024820152701359195e14ddd85c0e8811561412549151607a1b604482015290519081900360640190fd5b6003546001600160a01b0380891660008181526004602090815260408083208054600180820190925582517f6e71edae12b1b97f4d1f60370fef10105fa2faae0126114a169c64845d6126c98186015280840196909652958d166060860152608085018c905260a085019590955260c08085018b90528151808603909101815260e08501825280519083012061190160f01b6101008601526101028501969096526101228085019690965280518085039096018652610142840180825286519683019690962095839052610162840180825286905260ff89166101828501526101a284018890526101c28401879052519193926101e280820193601f1981019281900390910190855afa158015611807573d6000803e3d6000fd5b5050604051601f1901519150506001600160a01b0381161580159061183d5750886001600160a01b0316816001600160a01b0316145b61188e576040805162461bcd60e51b815260206004820152601b60248201527f4d646578537761703a20494e56414c49445f5349474e41545552450000000000604482015290519081900360640190fd5b611899898989611e22565b505050505050505050565b600260209081526000928352604080842090915290825290205481565b600c5460011461190b576040805162461bcd60e51b815260206004820152601060248201526f1359195e14ddd85c0e881313d0d2d15160821b604482015290519081900360640190fd5b6000600c55600654604080516370a0823160e01b81523060048201529051611a1b926001600160a01b0316916370a08231916024808301926020929190829003018186803b15801561195c57600080fd5b505afa158015611970573d6000803e3d6000fd5b505050506040513d602081101561198657600080fd5b5051600754604080516370a0823160e01b815230600482015290516001600160a01b03909216916370a0823191602480820192602092909190829003018186803b1580156119d357600080fd5b505afa1580156119e7573d6000803e3d6000fd5b505050506040513d60208110156119fd57600080fd5b50516008546001600160701b0380821691600160701b900416611c5e565b6001600c55565b604080518082018252601981527f7472616e7366657228616464726573732c75696e74323536290000000000000060209182015281516001600160a01b0385811660248301526044808301869052845180840390910181526064909201845291810180516001600160e01b031663a9059cbb60e01b1781529251815160009460609489169392918291908083835b60208310611acf5780518252601f199092019160209182019101611ab0565b6001836020036101000a0380198251168184511680821785525050505050509050019150506000604051808303816000865af19150503d8060008114611b31576040519150601f19603f3d011682016040523d82523d6000602084013e611b36565b606091505b5091509150818015611b64575080511580611b645750808060200190516020811015611b6157600080fd5b50515b611bb5576040805162461bcd60e51b815260206004820152601960248201527f4d646578537761703a205452414e534645525f4641494c454400000000000000604482015290519081900360640190fd5b5050505050565b600082611bcb57506000610bbd565b82820282848281611bd857fe5b0414611c155760405162461bcd60e51b81526004018080602001828103825260218152602001806124cd6021913960400191505060405180910390fd5b9392505050565b6000611c1583836040518060400160405280601e81526020017f536166654d6174683a207375627472616374696f6e206f766572666c6f7700008152506122f4565b6001600160701b038411801590611c7c57506001600160701b038311155b611cc2576040805162461bcd60e51b81526020600482015260126024820152714d646578537761703a204f564552464c4f5760701b604482015290519081900360640190fd5b60085463ffffffff42811691600160e01b90048116820390811615801590611cf257506001600160701b03841615155b8015611d0657506001600160701b03831615155b15611d77578063ffffffff16611d3485611d1f8661238b565b6001600160e01b03169063ffffffff61239d16565b600980546001600160e01b03929092169290920201905563ffffffff8116611d5f84611d1f8761238b565b600a80546001600160e01b0392909216929092020190555b600880546dffffffffffffffffffffffffffff19166001600160701b03888116919091176dffffffffffffffffffffffffffff60701b1916600160701b8883168102919091176001600160e01b0316600160e01b63ffffffff871602179283905560408051848416815291909304909116602082015281517f1c411e9a96e071241c2f21f7726b17ae89e3cab4c78be50e062b03a9fffbbad1929181900390910190a1505050505050565b6001600160a01b03808416600081815260026020908152604080832094871680845294825291829020859055815185815291517f8c5be1e5ebec7d5bd14f71427d1e84f3dd0314c0f7b2291e5b200ac8c7c3b9259281900390910190a3505050565b6001600160a01b038316600090815260016020526040902054611ead908263ffffffff611c1c16565b6001600160a01b038085166000908152600160205260408082209390935590841681522054611ee2908263ffffffff6123c216565b6001600160a01b0380841660008181526001602090815260409182902094909455805185815290519193928716927fddf252ad1be2c89b69c2b068fc378daa952ba7f163c4a11628f55a4df523b3ef92918290030190a3505050565b600080600560009054906101000a90046001600160a01b03166001600160a01b031663017e7e586040518163ffffffff1660e01b815260040160206040518083038186803b158015611f8f57600080fd5b505afa158015611fa3573d6000803e3d6000fd5b505050506040513d6020811015611fb957600080fd5b5051600b546001600160a01b0382161580159450919250906121015780156120fc576000611ffc610ef56001600160701b0388811690881663ffffffff611bbc16565b9050600061200983612115565b9050808211156120f9576000612037612028848463ffffffff611c1c16565b6000549063ffffffff611bbc16565b905060006120d5836120c9600560009054906101000a90046001600160a01b03166001600160a01b031663deba86e36040518163ffffffff1660e01b815260040160206040518083038186803b15801561209057600080fd5b505afa1580156120a4573d6000803e3d6000fd5b505050506040513d60208110156120ba57600080fd5b5051879063ffffffff611bbc16565b9063ffffffff6123c216565b905060008183816120e257fe5b04905080156120f5576120f58782612167565b5050505b50505b61210d565b801561210d576000600b555b505092915050565b60006003821115612158575080600160028204015b818110156121525780915060028182858161214157fe5b04018161214a57fe5b04905061212a565b50612162565b8115612162575060015b919050565b60005461217a908263ffffffff6123c216565b60009081556001600160a01b0383168152600160205260409020546121a5908263ffffffff6123c216565b6001600160a01b03831660008181526001602090815260408083209490945583518581529351929391927fddf252ad1be2c89b69c2b068fc378daa952ba7f163c4a11628f55a4df523b3ef9281900390910190a35050565b60008183111561220d5781611c15565b5090919050565b6001600160a01b03821660009081526001602052604090205461223d908263ffffffff611c1c16565b6001600160a01b0383166000908152600160205260408120919091555461226a908263ffffffff611c1c16565b60009081556040805183815290516001600160a01b038516917fddf252ad1be2c89b69c2b068fc378daa952ba7f163c4a11628f55a4df523b3ef919081900360200190a35050565b6000611c1583836040518060400160405280601a81526020017f536166654d6174683a206469766973696f6e206279207a65726f00000000000081525061241c565b600081848411156123835760405162461bcd60e51b81526004018080602001828103825283818151815260200191508051906020019080838360005b83811015612348578181015183820152602001612330565b50505050905090810190601f1680156123755780820380516001836020036101000a031916815260200191505b509250505060405180910390fd5b505050900390565b6001600160701b0316600160701b0290565b60006001600160701b0382166001600160e01b038416816123ba57fe5b049392505050565b600082820183811015611c15576040805162461bcd60e51b815260206004820152601b60248201527f536166654d6174683a206164646974696f6e206f766572666c6f770000000000604482015290519081900360640190fd5b6000818361246b5760405162461bcd60e51b8152602060048201818152835160248401528351909283926044909101919085019080838360008315612348578181015183820152602001612330565b50600083858161247757fe5b049594505050505056fe4d646578537761703a20494e53554646494349454e545f4c49515549444954595f4255524e45444d646578537761703a20494e53554646494349454e545f4f55545055545f414d4f554e54536166654d6174683a206d756c7469706c69636174696f6e206f766572666c6f774d646578537761703a20494e53554646494349454e545f494e5055545f414d4f554e544d646578537761703a20494e53554646494349454e545f4c49515549444954595f4d494e544544a265627a7a72315820e30e20fb6bf7f159a285693bc472baafe0646ade261c01b439303f9a440d5bd264736f6c63430005100032454950373132446f6d61696e28737472696e67206e616d652c737472696e672076657273696f6e2c75696e7432353620636861696e49642c6164647265737320766572696679696e67436f6e747261637429",
  "deployedBytecode": "0x608060405234801561001057600080fd5b50600436106101c45760003560e01c806370a08231116100f9578063ba9a7a5611610097578063d21220a711610071578063d21220a71461057b578063d505accf14610583578063dd62ed3e146105d4578063fff6cae914610602576101c4565b8063ba9a7a5614610545578063bc25cf771461054d578063c45a015514610573576101c4565b806389afcb44116100d357806389afcb44146104a657806395d89b41146104e5578063a9059cbb146104ed578063ad9b802414610519576101c4565b806370a08231146104525780637464fc3d146104785780637ecebe0014610480576101c4565b806330adf81f11610166578063485cc95511610140578063485cc955146103ee5780635909c0d51461041c5780635a3d5493146104245780636a6278421461042c576101c4565b806330adf81f146103c0578063313ce567146103c85780633644e515146103e6576101c4565b8063095ea7b3116101a2578063095ea7b31461030c5780630dfe16811461034c57806318160ddd1461037057806323b872dd1461038a576101c4565b8063022c0d9f146101c957806306fdde03146102575780630902f1ac146102d4575b600080fd5b610255600480360360808110156101df57600080fd5b8135916020810135916001600160a01b03604083013516919081019060808101606082013564010000000081111561021657600080fd5b82018360208201111561022857600080fd5b8035906020019184600183028401116401000000008311171561024a57600080fd5b50909250905061060a565b005b61025f610b58565b6040805160208082528351818301528351919283929083019185019080838360005b83811015610299578181015183820152602001610281565b50505050905090810190601f1680156102c65780820380516001836020036101000a031916815260200191505b509250505060405180910390f35b6102dc610b82565b604080516001600160701b03948516815292909316602083015263ffffffff168183015290519081900360600190f35b6103386004803603604081101561032257600080fd5b506001600160a01b038135169060200135610bac565b604080519115158252519081900360200190f35b610354610bc3565b604080516001600160a01b039092168252519081900360200190f35b610378610bd2565b60408051918252519081900360200190f35b610338600480360360608110156103a057600080fd5b506001600160a01b03813581169160208101359091169060400135610bd8565b610378610c72565b6103d0610c96565b6040805160ff9092168252519081900360200190f35b610378610c9b565b6102556004803603604081101561040457600080fd5b506001600160a01b0381358116916020013516610ca1565b610378610d24565b610378610d2a565b6103786004803603602081101561044257600080fd5b50356001600160a01b0316610d30565b6103786004803603602081101561046857600080fd5b50356001600160a01b031661102f565b610378611041565b6103786004803603602081101561049657600080fd5b50356001600160a01b0316611047565b6104cc600480360360208110156104bc57600080fd5b50356001600160a01b0316611059565b6040805192835260208301919091528051918290030190f35b61025f6113fe565b6103386004803603604081101561050357600080fd5b506001600160a01b03813516906020013561141e565b6103786004803603604081101561052f57600080fd5b506001600160a01b03813516906020013561142b565b610378611515565b6102556004803603602081101561056357600080fd5b50356001600160a01b031661151b565b610354611685565b610354611694565b610255600480360360e081101561059957600080fd5b506001600160a01b03813581169160208101359091169060408101359060608101359060ff6080820135169060a08101359060c001356116a3565b610378600480360360408110156105ea57600080fd5b506001600160a01b03813581169160200135166118a4565b6102556118c1565b600c54600114610654576040805162461bcd60e51b815260206004820152601060248201526f1359195e14ddd85c0e881313d0d2d15160821b604482015290519081900360640190fd5b6000600c55841515806106675750600084115b6106a25760405162461bcd60e51b81526004018080602001828103825260248152602001806124a96024913960400191505060405180910390fd5b6000806106ad610b82565b5091509150816001600160701b0316871080156106d25750806001600160701b031686105b610723576040805162461bcd60e51b815260206004820181905260248201527f4d646578537761703a20494e53554646494349454e545f4c4951554944495459604482015290519081900360640190fd5b60065460075460009182916001600160a01b039182169190811690891682148015906107615750806001600160a01b0316896001600160a01b031614155b6107a9576040805162461bcd60e51b81526020600482015260146024820152734d646578537761703a20494e56414c49445f544f60601b604482015290519081900360640190fd5b8a156107ba576107ba828a8d611a22565b89156107cb576107cb818a8c611a22565b861561088657886001600160a01b031663226dc882338d8d8c8c6040518663ffffffff1660e01b815260040180866001600160a01b03166001600160a01b03168152602001858152602001848152602001806020018281038252848482818152602001925080828437600081840152601f19601f8201169050808301925050509650505050505050600060405180830381600087803b15801561086d57600080fd5b505af1158015610881573d6000803e3d6000fd5b505050505b604080516370a0823160e01b815230600482015290516001600160a01b038416916370a08231916024808301926020929190829003018186803b1580156108cc57600080fd5b505afa1580156108e0573d6000803e3d6000fd5b505050506040513d60208110156108f657600080fd5b5051604080516370a0823160e01b815230600482015290519195506001600160a01b038316916370a0823191602480820192602092909190829003018186803b15801561094257600080fd5b505afa158015610956573d6000803e3d6000fd5b505050506040513d602081101561096c57600080fd5b5051925060009150506001600160701b0385168a9003831161098f57600061099e565b89856001600160701b03160383035b9050600089856001600160701b03160383116109bb5760006109ca565b89856001600160701b03160383035b905060008211806109db5750600081115b610a165760405162461bcd60e51b81526004018080602001828103825260238152602001806124ee6023913960400191505060405180910390fd5b6000610a4a610a2c84600363ffffffff611bbc16565b610a3e876103e863ffffffff611bbc16565b9063ffffffff611c1c16565b90506000610a62610a2c84600363ffffffff611bbc16565b9050610a93620f4240610a876001600160701b038b8116908b1663ffffffff611bbc16565b9063ffffffff611bbc16565b610aa3838363ffffffff611bbc16565b1015610ae4576040805162461bcd60e51b815260206004820152600b60248201526a4d646578537761703a204b60a81b604482015290519081900360640190fd5b5050610af284848888611c5e565b60408051838152602081018390528082018d9052606081018c905290516001600160a01b038b169133917fd78ad95fa46c994b6551d0da85fc275fe613ce37657fb8d5e3d130840159d8229181900360800190a350506001600c55505050505050505050565b6040518060400160405280600e81526020016d2429bbb0b8102628102a37b5b2b760911b81525081565b6008546001600160701b0380821692600160701b830490911691600160e01b900463ffffffff1690565b6000610bb9338484611e22565b5060015b92915050565b6006546001600160a01b031681565b60005481565b6001600160a01b038316600090815260026020908152604080832033845290915281205460001914610c5d576001600160a01b0384166000908152600260209081526040808320338452909152902054610c38908363ffffffff611c1c16565b6001600160a01b03851660009081526002602090815260408083203384529091529020555b610c68848484611e84565b5060019392505050565b7f6e71edae12b1b97f4d1f60370fef10105fa2faae0126114a169c64845d6126c981565b601281565b60035481565b6005546001600160a01b03163314610cf6576040805162461bcd60e51b815260206004820152601360248201527226b232bc29bbb0b81d102327a92124a22222a760691b604482015290519081900360640190fd5b600680546001600160a01b039384166001600160a01b03199182161790915560078054929093169116179055565b60095481565b600a5481565b6000600c54600114610d7c576040805162461bcd60e51b815260206004820152601060248201526f1359195e14ddd85c0e881313d0d2d15160821b604482015290519081900360640190fd5b6000600c81905580610d8c610b82565b50600654604080516370a0823160e01b815230600482015290519395509193506000926001600160a01b03909116916370a08231916024808301926020929190829003018186803b158015610de057600080fd5b505afa158015610df4573d6000803e3d6000fd5b505050506040513d6020811015610e0a57600080fd5b5051600754604080516370a0823160e01b815230600482015290519293506000926001600160a01b03909216916370a0823191602480820192602092909190829003018186803b158015610e5d57600080fd5b505afa158015610e71573d6000803e3d6000fd5b505050506040513d6020811015610e8757600080fd5b505190506000610ea6836001600160701b03871663ffffffff611c1c16565b90506000610ec3836001600160701b03871663ffffffff611c1c16565b90506000610ed18787611f3e565b60005490915080610f0e57610efa6103e8610a3e610ef5878763ffffffff611bbc16565b612115565b9850610f0960006103e8612167565b610f5d565b610f5a6001600160701b038916610f2b868463ffffffff611bbc16565b81610f3257fe5b046001600160701b038916610f4d868563ffffffff611bbc16565b81610f5457fe5b046121fd565b98505b60008911610f9c5760405162461bcd60e51b81526004018080602001828103825260278152602001806125116027913960400191505060405180910390fd5b610fa68a8a612167565b610fb286868a8a611c5e565b8115610fe257600854610fde906001600160701b0380821691600160701b90041663ffffffff611bbc16565b600b555b6040805185815260208101859052815133927f4c209b5fc8ad50758f13e2e1088ba56a560dff690a1c6fef26394f4c03821c4f928290030190a250506001600c5550949695505050505050565b60016020526000908152604090205481565b600b5481565b60046020526000908152604090205481565b600080600c546001146110a6576040805162461bcd60e51b815260206004820152601060248201526f1359195e14ddd85c0e881313d0d2d15160821b604482015290519081900360640190fd5b6000600c819055806110b6610b82565b50600654600754604080516370a0823160e01b815230600482015290519496509294506001600160a01b039182169391169160009184916370a08231916024808301926020929190829003018186803b15801561111257600080fd5b505afa158015611126573d6000803e3d6000fd5b505050506040513d602081101561113c57600080fd5b5051604080516370a0823160e01b815230600482015290519192506000916001600160a01b038516916370a08231916024808301926020929190829003018186803b15801561118a57600080fd5b505afa15801561119e573d6000803e3d6000fd5b505050506040513d60208110156111b457600080fd5b5051306000908152600160205260408120549192506111d38888611f3e565b600054909150806111ea848763ffffffff611bbc16565b816111f157fe5b049a5080611205848663ffffffff611bbc16565b8161120c57fe5b04995060008b11801561121f575060008a115b61125a5760405162461bcd60e51b81526004018080602001828103825260278152602001806124826027913960400191505060405180910390fd5b6112643084612214565b61126f878d8d611a22565b61127a868d8c611a22565b604080516370a0823160e01b815230600482015290516001600160a01b038916916370a08231916024808301926020929190829003018186803b1580156112c057600080fd5b505afa1580156112d4573d6000803e3d6000fd5b505050506040513d60208110156112ea57600080fd5b5051604080516370a0823160e01b815230600482015290519196506001600160a01b038816916370a0823191602480820192602092909190829003018186803b15801561133657600080fd5b505afa15801561134a573d6000803e3d6000fd5b505050506040513d602081101561136057600080fd5b5051935061137085858b8b611c5e565b81156113a05760085461139c906001600160701b0380821691600160701b90041663ffffffff611bbc16565b600b555b604080518c8152602081018c905281516001600160a01b038f169233927fdccd412f0b1252819cb1fd330b93224ca42612892bb3f4f789976e6d81936496929081900390910190a35050505050505050506001600c81905550915091565b604051806040016040528060048152602001630909a88b60e31b81525081565b6000610bb9338484611e84565b6006546000906001600160a01b0384811691161480159061145a57506007546001600160a01b03848116911614155b8061146e57506008546001600160701b0316155b806114895750600854600160701b90046001600160701b0316155b1561149657506000610bbd565b6006546001600160a01b03848116911614156114eb576008546114e4906001600160701b03808216916114d891600160701b909104168563ffffffff611bbc16565b9063ffffffff6122b216565b9050610bbd565b6008546114e4906001600160701b03600160701b82048116916114d891168563ffffffff611bbc16565b6103e881565b600c54600114611565576040805162461bcd60e51b815260206004820152601060248201526f1359195e14ddd85c0e881313d0d2d15160821b604482015290519081900360640190fd5b6000600c55600654600754600854604080516370a0823160e01b815230600482015290516001600160a01b039485169490931692611614928592879261160f926001600160701b03169185916370a0823191602480820192602092909190829003018186803b1580156115d757600080fd5b505afa1580156115eb573d6000803e3d6000fd5b505050506040513d602081101561160157600080fd5b50519063ffffffff611c1c16565b611a22565b600854604080516370a0823160e01b8152306004820152905161167b928492879261160f92600160701b90046001600160701b0316916001600160a01b038616916370a0823191602480820192602092909190829003018186803b1580156115d757600080fd5b50506001600c5550565b6005546001600160a01b031681565b6007546001600160a01b031681565b428410156116ec576040805162461bcd60e51b81526020600482015260116024820152701359195e14ddd85c0e8811561412549151607a1b604482015290519081900360640190fd5b6003546001600160a01b0380891660008181526004602090815260408083208054600180820190925582517f6e71edae12b1b97f4d1f60370fef10105fa2faae0126114a169c64845d6126c98186015280840196909652958d166060860152608085018c905260a085019590955260c08085018b90528151808603909101815260e08501825280519083012061190160f01b6101008601526101028501969096526101228085019690965280518085039096018652610142840180825286519683019690962095839052610162840180825286905260ff89166101828501526101a284018890526101c28401879052519193926101e280820193601f1981019281900390910190855afa158015611807573d6000803e3d6000fd5b5050604051601f1901519150506001600160a01b0381161580159061183d5750886001600160a01b0316816001600160a01b0316145b61188e576040805162461bcd60e51b815260206004820152601b60248201527f4d646578537761703a20494e56414c49445f5349474e41545552450000000000604482015290519081900360640190fd5b611899898989611e22565b505050505050505050565b600260209081526000928352604080842090915290825290205481565b600c5460011461190b576040805162461bcd60e51b815260206004820152601060248201526f1359195e14ddd85c0e881313d0d2d15160821b604482015290519081900360640190fd5b6000600c55600654604080516370a0823160e01b81523060048201529051611a1b926001600160a01b0316916370a08231916024808301926020929190829003018186803b15801561195c57600080fd5b505afa158015611970573d6000803e3d6000fd5b505050506040513d602081101561198657600080fd5b5051600754604080516370a0823160e01b815230600482015290516001600160a01b03909216916370a0823191602480820192602092909190829003018186803b1580156119d357600080fd5b505afa1580156119e7573d6000803e3d6000fd5b505050506040513d60208110156119fd57600080fd5b50516008546001600160701b0380821691600160701b900416611c5e565b6001600c55565b604080518082018252601981527f7472616e7366657228616464726573732c75696e74323536290000000000000060209182015281516001600160a01b0385811660248301526044808301869052845180840390910181526064909201845291810180516001600160e01b031663a9059cbb60e01b1781529251815160009460609489169392918291908083835b60208310611acf5780518252601f199092019160209182019101611ab0565b6001836020036101000a0380198251168184511680821785525050505050509050019150506000604051808303816000865af19150503d8060008114611b31576040519150601f19603f3d011682016040523d82523d6000602084013e611b36565b606091505b5091509150818015611b64575080511580611b645750808060200190516020811015611b6157600080fd5b50515b611bb5576040805162461bcd60e51b815260206004820152601960248201527f4d646578537761703a205452414e534645525f4641494c454400000000000000604482015290519081900360640190fd5b5050505050565b600082611bcb57506000610bbd565b82820282848281611bd857fe5b0414611c155760405162461bcd60e51b81526004018080602001828103825260218152602001806124cd6021913960400191505060405180910390fd5b9392505050565b6000611c1583836040518060400160405280601e81526020017f536166654d6174683a207375627472616374696f6e206f766572666c6f7700008152506122f4565b6001600160701b038411801590611c7c57506001600160701b038311155b611cc2576040805162461bcd60e51b81526020600482015260126024820152714d646578537761703a204f564552464c4f5760701b604482015290519081900360640190fd5b60085463ffffffff42811691600160e01b90048116820390811615801590611cf257506001600160701b03841615155b8015611d0657506001600160701b03831615155b15611d77578063ffffffff16611d3485611d1f8661238b565b6001600160e01b03169063ffffffff61239d16565b600980546001600160e01b03929092169290920201905563ffffffff8116611d5f84611d1f8761238b565b600a80546001600160e01b0392909216929092020190555b600880546dffffffffffffffffffffffffffff19166001600160701b03888116919091176dffffffffffffffffffffffffffff60701b1916600160701b8883168102919091176001600160e01b0316600160e01b63ffffffff871602179283905560408051848416815291909304909116602082015281517f1c411e9a96e071241c2f21f7726b17ae89e3cab4c78be50e062b03a9fffbbad1929181900390910190a1505050505050565b6001600160a01b03808416600081815260026020908152604080832094871680845294825291829020859055815185815291517f8c5be1e5ebec7d5bd14f71427d1e84f3dd0314c0f7b2291e5b200ac8c7c3b9259281900390910190a3505050565b6001600160a01b038316600090815260016020526040902054611ead908263ffffffff611c1c16565b6001600160a01b038085166000908152600160205260408082209390935590841681522054611ee2908263ffffffff6123c216565b6001600160a01b0380841660008181526001602090815260409182902094909455805185815290519193928716927fddf252ad1be2c89b69c2b068fc378daa952ba7f163c4a11628f55a4df523b3ef92918290030190a3505050565b600080600560009054906101000a90046001600160a01b03166001600160a01b031663017e7e586040518163ffffffff1660e01b815260040160206040518083038186803b158015611f8f57600080fd5b505afa158015611fa3573d6000803e3d6000fd5b505050506040513d6020811015611fb957600080fd5b5051600b546001600160a01b0382161580159450919250906121015780156120fc576000611ffc610ef56001600160701b0388811690881663ffffffff611bbc16565b9050600061200983612115565b9050808211156120f9576000612037612028848463ffffffff611c1c16565b6000549063ffffffff611bbc16565b905060006120d5836120c9600560009054906101000a90046001600160a01b03166001600160a01b031663deba86e36040518163ffffffff1660e01b815260040160206040518083038186803b15801561209057600080fd5b505afa1580156120a4573d6000803e3d6000fd5b505050506040513d60208110156120ba57600080fd5b5051879063ffffffff611bbc16565b9063ffffffff6123c216565b905060008183816120e257fe5b04905080156120f5576120f58782612167565b5050505b50505b61210d565b801561210d576000600b555b505092915050565b60006003821115612158575080600160028204015b818110156121525780915060028182858161214157fe5b04018161214a57fe5b04905061212a565b50612162565b8115612162575060015b919050565b60005461217a908263ffffffff6123c216565b60009081556001600160a01b0383168152600160205260409020546121a5908263ffffffff6123c216565b6001600160a01b03831660008181526001602090815260408083209490945583518581529351929391927fddf252ad1be2c89b69c2b068fc378daa952ba7f163c4a11628f55a4df523b3ef9281900390910190a35050565b60008183111561220d5781611c15565b5090919050565b6001600160a01b03821660009081526001602052604090205461223d908263ffffffff611c1c16565b6001600160a01b0383166000908152600160205260408120919091555461226a908263ffffffff611c1c16565b60009081556040805183815290516001600160a01b038516917fddf252ad1be2c89b69c2b068fc378daa952ba7f163c4a11628f55a4df523b3ef919081900360200190a35050565b6000611c1583836040518060400160405280601a81526020017f536166654d6174683a206469766973696f6e206279207a65726f00000000000081525061241c565b600081848411156123835760405162461bcd60e51b81526004018080602001828103825283818151815260200191508051906020019080838360005b83811015612348578181015183820152602001612330565b50505050905090810190601f1680156123755780820380516001836020036101000a031916815260200191505b509250505060405180910390fd5b505050900390565b6001600160701b0316600160701b0290565b60006001600160701b0382166001600160e01b038416816123ba57fe5b049392505050565b600082820183811015611c15576040805162461bcd60e51b815260206004820152601b60248201527f536166654d6174683a206164646974696f6e206f766572666c6f770000000000604482015290519081900360640190fd5b6000818361246b5760405162461bcd60e51b8152602060048201818152835160248401528351909283926044909101919085019080838360008315612348578181015183820152602001612330565b50600083858161247757fe5b049594505050505056fe4d646578537761703a20494e53554646494349454e545f4c49515549444954595f4255524e45444d646578537761703a20494e53554646494349454e545f4f55545055545f414d4f554e54536166654d6174683a206d756c7469706c69636174696f6e206f766572666c6f774d646578537761703a20494e53554646494349454e545f494e5055545f414d4f554e544d646578537761703a20494e53554646494349454e545f4c49515549444954595f4d494e544544a265627a7a72315820e30e20fb6bf7f159a285693bc472baafe0646ade261c01b439303f9a440d5bd264736f6c63430005100032",
  "devdoc": {
    "methods": {}
  },
  "userdoc": {
    "methods": {}
  },
  "storageLayout": {
    "storage": [
      {
        "astId": 643,
        "contract": "contracts/common/MdexFactory.sol:MdexPair",
        "label": "totalSupply",
        "offset": 0,
        "slot": "0",
        "type": "t_uint256"
      },
      {
        "astId": 647,
        "contract": "contracts/common/MdexFactory.sol:MdexPair",
        "label": "balanceOf",
        "offset": 0,
        "slot": "1",
        "type": "t_mapping(t_address,t_uint256)"
      },
      {
        "astId": 653,
        "contract": "contracts/common/MdexFactory.sol:MdexPair",
        "label": "allowance",
        "offset": 0,
        "slot": "2",
        "type": "t_mapping(t_address,t_mapping(t_address,t_uint256))"
      },
      {
        "astId": 655,
        "contract": "contracts/common/MdexFactory.sol:MdexPair",
        "label": "DOMAIN_SEPARATOR",
        "offset": 0,
        "slot": "3",
        "type": "t_bytes32"
      },
      {
        "astId": 662,
        "contract": "contracts/common/MdexFactory.sol:MdexPair",
        "label": "nonces",
        "offset": 0,
        "slot": "4",
        "type": "t_mapping(t_address,t_uint256)"
      },
      {
        "astId": 1034,
        "contract": "contracts/common/MdexFactory.sol:MdexPair",
        "label": "factory",
        "offset": 0,
        "slot": "5",
        "type": "t_address"
      },
      {
        "astId": 1036,
        "contract": "contracts/common/MdexFactory.sol:MdexPair",
        "label": "token0",
        "offset": 0,
        "slot": "6",
        "type": "t_address"
      },
      {
        "astId": 1038,
        "contract": "contracts/common/MdexFactory.sol:MdexPair",
        "label": "token1",
        "offset": 0,
        "slot": "7",
        "type": "t_address"
      },
      {
        "astId": 1040,
        "contract": "contracts/common/MdexFactory.sol:MdexPair",
        "label": "reserve0",
        "offset": 0,
        "slot": "8",
        "type": "t_uint112"
      },
      {
        "astId": 1042,
        "contract": "contracts/common/MdexFactory.sol:MdexPair",
        "label": "reserve1",
        "offset": 14,
        "slot": "8",
        "type": "t_uint112"
      },
      {
        "astId": 1044,
        "contract": "contracts/common/MdexFactory.sol:MdexPair",
        "label": "blockTimestampLast",
        "offset": 28,
        "slot": "8",
        "type": "t_uint32"
      },
      {
        "astId": 1046,
        "contract": "contracts/common/MdexFactory.sol:MdexPair",
        "label": "price0CumulativeLast",
        "offset": 0,
        "slot": "9",
        "type": "t_uint256"
      },
      {
        "astId": 1048,
        "contract": "contracts/common/MdexFactory.sol:MdexPair",
        "label": "price1CumulativeLast",
        "offset": 0,
        "slot": "10",
        "type": "t_uint256"
      },
      {
        "astId": 1050,
        "contract": "contracts/common/MdexFactory.sol:MdexPair",
        "label": "kLast",
        "offset": 0,
        "slot": "11",
        "type": "t_uint256"
      },
      {
        "astId": 1053,
        "contract": "contracts/common/MdexFactory.sol:MdexPair",
        "label": "unlocked",
        "offset": 0,
        "slot": "12",
        "type": "t_uint256"
      }
    ],
    "types": {
      "t_address": {
        "encoding": "inplace",
        "label": "address",
        "numberOfBytes": "20"
      },
      "t_bytes32": {
        "encoding": "inplace",
        "label": "bytes32",
        "numberOfBytes": "32"
      },
      "t_mapping(t_address,t_mapping(t_address,t_uint256))": {
        "encoding": "mapping",
        "key": "t_address",
        "label": "mapping(address => mapping(address => uint256))",
        "numberOfBytes": "32",
        "value": "t_mapping(t_address,t_uint256)"
      },
      "t_mapping(t_address,t_uint256)": {
        "encoding": "mapping",
        "key": "t_address",
        "label": "mapping(address => uint256)",
        "numberOfBytes": "32",
        "value": "t_uint256"
      },
      "t_uint112": {
        "encoding": "inplace",
        "label": "uint112",
        "numberOfBytes": "14"
      },
      "t_uint256": {
        "encoding": "inplace",
        "label": "uint256",
        "numberOfBytes": "32"
      },
      "t_uint32": {
        "encoding": "inplace",
        "label": "uint32",
        "numberOfBytes": "4"
      }
    }
  }
}